Question,Option A,Option B,Option C,Option D,Correct Answer
"Through whom was it announced on 1st November, 1858, that India would be governed in the name of the British Crown?",Secretary of State,Queen Elizabeth,Prime Minister of Britain,Queen Victoria,d
Which of the following statements is INCORRECT regarding the factors responsible for the development of the modern national movement in India?,Political diversity in India,Economic exploitation by the British,Spread of western education,Socio-religious reforms,a
"In which year was the Mahalwari system started in western Uttar Pradesh, Madhya Pradesh, and parts of Punjab?",1881,1858,1820,1830,d
Ryotwari system was introduced in Bombay and Madras in which year?,1883,1857,1820,1918,c
"Who introduced the monopoly system, giving revenue collection rights to the highest bidder for 5 years?",M.R. Jayakar,Tejchand,Warren Hastings,Satyendra Nath Tagore,c
Which of the following was NOT a key item exported from Bengal in the first half of the eighteenth century?,Raw silk,Saltpetre,Indigo,Sugar,c
In what year did M.R. Jayakar present his report as a member of the Indian Industries Commission?,1883,1881,1858,1918,d
On which date was it announced that India would be governed in the name of the British Crown?,"1st January, 1857","1st November, 1858","1st August, 1857","1st October, 1858",b
"At the time of the implementation of the Permanent Settlement, who was the king of Vardhaman?",Warren Hastings,Satyendra Nath Tagore,Dadabhai Naoroji,Tejchand,d
"Before the Champaran Satyagraha, the farmers of Champaran followed the 'Panchkathiya' system, in which what was sown in five katthas of one bigha of land?",Sugar,Opium,Saltpetre,Indigo,d
"In the present western Uttar Pradesh, Madhya Pradesh and parts of Punjab, which system was started in 1830?",Permanent Settlement,Ryotwari System,Monopoly System,Mahalwari System,d
The Ryotwari system was introduced in which of the following locations?,Bengal and Punjab,Bombay and Madras,Uttar Pradesh and Madhya Pradesh,Vardhaman and Champaran,b
"Who introduced the monopoly system, according to which the right to collect revenue was given to the highest bidder for a period of 5 years?",Strachey Commission,M.R. Jayakar,Dadabhai Naoroji,Warren Hastings,d
"The Indian Famine Code, 1883 was prepared by which commission?",Indian Industries Commission,Queen Victoria Commission,Strachey Commission,Warren Hastings Commission,c
In which year was the first Factory Act during the colonial rule in India passed?,1820,1857,1881,1883,c
The 'Revolt of 1857' was started by whom?,Farmers,Soldiers,Landlords,Politicians,b
On which date was it announced that India would henceforth be governed in the name of the British Crown through a Secretary of State?,"1st January, 1857","1st November, 1858","1st January, 1883","1st November, 1820",b
Who was the last Nawab of Awadh?,Bahadur Shah Zafar,Mangal Pandey,Wajid Ali Shah,Nana Saheb,c
"In 1770, what incident resulted in the death of a third of Bengal's population?",Famine,Plague,War,Draught,d
Which of the following personalities is NOT directly related to the freedom struggle of 1857?,Mangal Pandey,Bhagat Singh,Tantya Tope,Shahmal,b
Which of the following was NOT a stated cause of the revolt of 1857?,Dalhousie's kidnapping policy,Greased cartridges,Economic exploitation,Transfer of powers to the British Crown,d
What was the primary result of the Revolt of 1857?,Increased power of the East India Company,Transfer of power to the British Crown,Complete independence of India,Appointment of Bahadur Shah Zafar as Emperor,b
"Mangal Pandey, who rebelled, was a soldier in which regiment?",36th Native Infantry Regiment,34th Native Infantry Regiment,32nd Native Infantry Regiment,30th Native Infantry Regiment,b
Who raised and led an army against the British after they took over her kingdom?,Rani Lakshmibai,Ramgarh,Shahmal,Nana Saheb,b
"In 1857, the sepoys objected to the cartridges manufactured by which company?",East India Company,British Crown,Anfield Company,Bengal Army,c
In which year was Tantya Tope hanged by the British?,1856,1857,1858,1859,d
In which year did the British formally annex the Awadh state?,1855,1856,1857,1858,b
In which month and year was Shahmal killed in the battle of Baraut during the Revolt of 1857?,August 1857,June 1857,July 1857,September 1857,c
Who mobilized the headmen and peasants of Pargana Baraut during the Revolt of 1857?,Tantya Tope,Mangal Pandey,Shahmal,Nana Saheb,c
What event is described as beginning with a rebellion of soldiers in Meerut and posing a challenge to British rule?,Sepoy Mutiny,Indian Rebellion of 1857,Battle of Plassey,Battle of Buxar,b
"During the First War of Independence of 1857, which location served as Nana Saheb's headquarters in the Kanpur region?",Lucknow,Jhansi,Bithoor,Meerut,c
Who is credited with igniting the first spark of independence?,Bahadur Shah Zafar,Tantya Tope,Mangal Pandey,Shahmal,c
In what year did the British formally annex the Awadh state?,1770,1859,1857,1856,d
"In 1770, approximately what fraction of the population died in Bengal, India, due to a specific incident?",One-half,One-quarter,One-third,Two-thirds,c
Which of the following is NOT directly associated with the freedom struggle of 1857?,Mangal Pandey,Tantya Tope,Bhagat Singh,Shahmal,c
Which of the following contributed to the Revolt of 1857?,Dalhousie's kidnapping policy,Economic exploitation,Greased cartridges,All of the above,d
What was the primary outcome of the Revolt of 1857?,Expansion of East India Company powers,Dissolution of the British Crown,Transfer of power to the British Crown,Implementation of Dalhousie's policies,c
"Mangal Pandey, when he rebelled, was a soldier in which regiment?",35th Native Infantry Regiment,34th Native Infantry Regiment,36th Native Infantry Regiment,33th Native Infantry Regiment,b
Which company manufactured the cartridges that the sepoys objected to in 1857?,East India Company,British Cartridge Company,Anfield Company,Royal Ammunition Company,c
In what year was Tantya Tope hanged by the British?,1856,1857,1858,1859,d
In which location was Tantya Tope hanged?,Meerut,Barrackpore,Shivpuri,Baraut,c
In what month and year was Shahmal killed in the battle during the Revolt of 1857?,June 1857,August 1857,July 1857,May 1857,c
In which city did the soldiers of the Bengal Army revolt on 10 May 1857?,Barrackpore,Shivpuri,Meerut,Bithoor,c
The Kanpur region resisted British rule during the First War of Independence using whose palace as headquarters?,Wajid Ali Shah,Nana Saheb,Shahmal,Bahadur Shah Zafar,b
Who ignited the first spark of independence?,Bahadur Shah Zafar,Shahmal,Mangal Pandey,Tantya Tope,c
Which incident in Bengal resulted in the death of a third of the population in 1770?,Mutiny,Rebellion,War,Draught,d
Which of the following is NOT directly related to the freedom struggle of 1857?,Mangal Pandey,Bhagat Singh,Tantya Tope,Shahmal,b
In which regiment was Mangal Pandey a soldier when he rebelled?,35th Native Infantry Regiment,36th Native Infantry Regiment,34th Native Infantry Regiment,33rd Native Infantry Regiment,c
Where was Tantya Tope hanged in 1859?,Meerut,Shivpuri,Baraut,Barrackpore,b
In what month and year was Shahmal killed in battle during the Revolt of 1857?,June 1857,July 1857,August 1857,May 1857,b
Who was the Mughal Emperor at the time of the soldiers' revolt in Meerut on 10 May 1857?,Wajid Ali Shah,Shahmal,Nana Saheb,Bahadur Shah Zafar,d
The Indian Rebellion of 1857 began in which location?,Barrackpore,Bithoor,Meerut,Shivpuri,c
"Where was Nana Saheb's palace, used as the headquarters of resistance in the Kanpur region?",Baraut,Bithoor,Barrackpore,Shivpuri,b
Which of the following is NOT associated with the freedom struggle of 1857?,Greased cartridges,Bhagat Singh,Economic exploitation,Dalhousie's kidnapping policy,b
Tantya Tope was hanged by the British in 1859 in which location?,Meerut,Barrackpore,Shivpuri,Bithoor,c
"In 1770, a third of the population died in Bengal, India, as a result of what event?",War,Plague,Draught,Rebellion,c
Mangal Pandey was a soldier in which regiment?,35th Native Infantry Regiment,34th Native Infantry Regiment,36th Native Infantry Regiment,33rd Native Infantry Regiment,b
Where was Mangal Pandey stationed when he rebelled?,Shivpuri,Meerut,Barrackpore,Baraut,c
"Shahmal, a rebel in Baraut, Uttar Pradesh, was killed in which month of 1857?",August,June,May,July,d
"During the Revolt of 1857, the Kanpur region used which place as its headquarters to resist British rule?",Shivpuri,Bithoor,Baraut,Meerut,b
On what date did the soldiers of the Bengal Army revolt in Meerut?,11 May 1857,9 May 1857,10 May 1857,12 May 1857,c
"In what year did Bahadur Shah Zafar, the last ruler of the Mughal dynasty, have his power dismissed by the British?",1862,1858,1857,1859,c
Where did the Indian Rebellion of 1857 initially commence?,Allahabad,Baraut,Rangoon,Meerut,d
Which of the following is INCORRECT regarding Mangal Pandey?,He was exiled to Rangoon.,He died in 1862.,He was tried for leading the rebels of the 1857 rebellion.,He helped the British during the Santhal rebellion.,d
Who was the Governor General of India during the Sepoy Mutiny?,Henry Harding,Lord Canning,V.D. Savarkar,Maharaja Mehtab Chand,b
Which of the following statements is NOT correct about the 1857 rebellion?,Shahmal led the rebellion at Baraut.,It was first called 'India's First War of Independence' by V.D. Savarkar.,It was suppressed by the British in 1859.,"It began on May 1, 1857.",d
Which item is directly associated with the 1857 rebellion?,Sati Abolition Act,Grease cartridges,Doctrine of Lapse,Permanent Settlement,b
"Match the following:

Column I
(A) Henry Harding
(B) Lord Canning

Column II
(1) Governor General during Sepoy Mutiny
(2) Introduced Enfield rifles

Choose the correct option:","A-1, B-2","A-2, B-1","A-1, B-1","A-2, B-2",b
Which infantry battalion was involved in the killing of all its white officers during the Revolt of 1857?,21st Native Infantry,31st Native Infantry,41st Native Infantry,51st Native Infantry,c
"Who proclaimed Queen Victoria's proclamation in Allahabad on November 1, 1858?",Henry Harding,V.D. Savarkar,Lord Dalhousie,Lord Canning,d
Who designated Allahabad as the emergency headquarters in 1857?,Bahadur Shah Zafar,Lord Canning,Maharaja Mehtab Chand,Henry Harding,b
Who was tried for leading the rebels of the 1857 rebellion and exiled to Rangoon?,Tatya Tope,Bahadur Shah Zafar,Mangal Pandey,Lord Canning,c
In what year did Bahadur Shah Zafar die in Rangoon after being exiled?,1856,1857,1862,1859,c
The Revolt of 1857 is also known as:,The Santhal Rebellion,India's Second War of Independence,The Sepoy Mutiny,The Mughal Dynasty Revolt,c
In which city did India's first war of independence begin?,Allahabad,Baraut,Rangoon,Meerut,d
Which infantry battalion was involved in the killing of its white officers during the Revolt of 1857?,21st Native Infantry,41st Native Infantry,31st Native Infantry,11th Native Infantry,b
"Who is credited with introducing the Enfield rifles and greased cartridges, an immediate cause of the 1857 rebellion?",Lord Canning,V.D. Savarkar,Henry Harding,Maharaja Mehtab Chand,c
At which place did Shahmal lead the rebellion in 1857?,Meerut,Allahabad,Baraut,Rangoon,c
Who helped the British during the Santhal rebellion and the revolt of 1857?,Lord Canning,Bahadur Shah Zafar,V.D. Savarkar,Maharaja Mehtab Chand,d
In which year was the revolt of 1857 finally suppressed by the British?,1856,1857,1858,1859,d
Who first called the 1857 revolt 'India's First War of Independence'?,Lord Canning,Henry Harding,V.D. Savarkar,Mangal Pandey,c
Who made Allahabad the emergency headquarters in 1857?,Henry Harding,V.D. Savarkar,Lord Canning,Bahadur Shah Zafar,c
On what date was Queen Victoria's proclamation read out in Allahabad?,"May 10, 1857","November 1, 1858","December 31, 1857","August 15, 1857",b
Which of the following statements is INCORRECT regarding the 1857 revolt?,The Sepoy Mutiny began in Meerut.,The 41st Native Infantry was involved in the killing of white officers.,Lord Canning was the Governor-General.,Mangal Pandey was exiled to Allahabad.,d
In which year did Mangal Pandey die in Rangoon after being exiled?,1859,1857,1862,1858,c
Who was the last ruler of the Mughal dynasty dismissed from power by the British in 1857?,Lord Canning,Henry Harding,Tatya Tope,Bahadur Shah Zafar,d
The Revolt of 1857 is also known as the:,Santhal Rebellion,Grease Cartridges Incident,First War of Indian Independence,Sepoy Mutiny,c
"In which city did India's first war of independence begin on May 10, 1857?",Allahabad,Baraut,Rangoon,Meerut,d
Which infantry battalion was involved in the killing of all its white officers in the Revolt of 1857?,1st Native Infantry,21st Native Infantry,41st Native Infantry,31st Native Infantry,c
"Who is credited with introducing the Enfield rifles, which used greased cartridges, an immediate cause of the 1857 rebellion?",Lord Canning,V.D. Savarkar,Henry Harding,Maharaja Mehtab Chand,c
Who described the Revolt of 1857 as 'India's First War of Independence'?,Lord Canning,Henry Harding,V.D. Savarkar,Maharaja Mehtab Chand,c
On which date was Queen Victoria's proclamation read out in Allahabad?,"May 10, 1857","November 1, 1858","January 1, 1857","December 31, 1858",b
Which of the following events immediately preceded the outbreak of the Indian Rebellion of 1857?,The annexation of Awadh,The role of Indian sepoys in the British Army,The introduction of the Doctrine of Lapse,The passing of the Charter Act of 1853,b
"Mangal Pandey, associated with the 1857 rebellion, was exiled to which location?",Calcutta,Madras,Rangoon,Bombay,c
"In what year did Bahadur Shah Zafar, the last ruler of the Mughal dynasty, die in exile?",1857,1858,1862,1859,c
Tatya Tope is known for his participation in the Indian freedom struggle of which year?,1807,1857,1907,1947,b
The 'First War of Indian Independence' is another name for which historical event?,The Santhal Rebellion,The Revolt of 1857,The Indigo Revolt,The Kuka Movement,b
In what year was the Revolt of 1857 finally suppressed by the British forces?,1856,1857,1858,1859,d
The immediate cause of the 1857 revolt can be attributed to which of the following?,The Doctrine of Lapse,Grease cartridges,Subsidiary Alliance,The Permanent Settlement,b
On what date did the first war of Indian independence begin in Meerut?,"May 8, 1857","May 9, 1857","May 10, 1857","May 11, 1857",c
"Who is credited with introducing the Enfield rifles, the use of which with greased cartridges triggered the 1857 rebellion?",Lord Dalhousie,Lord Canning,Henry Harding,Lord William Bentinck,c
"In 1857, Shahmal led the rebellion in which of the following locations?",Delhi,Baraut,Lucknow,Jhansi,b
Which of the following individuals helped the British during both the Santhal rebellion and the revolt of 1857?,Raja Ram Mohan Roy,Maharaja Mehtab Chand,Ishwar Chandra Vidyasagar,Dwarkanath Tagore,b
Who was the Governor-General of India during the Sepoy Mutiny of 1857?,Lord Dalhousie,Lord Curzon,Lord Canning,Lord Ripon,c
"Which year saw a major upheaval that shook the foundations of British rule in India, often referred to as the 'First War of Independence'?",1847,1857,1867,1877,b
Where did the Sepoy Mutiny initially begin?,Delhi,Lucknow,Meerut,Kanpur,c
Who first termed the Revolt of 1857 as 'India's First War of Independence'?,Mahatma Gandhi,Jawaharlal Nehru,V.D. Savarkar,Subhas Chandra Bose,c
"In which city was Queen Victoria's proclamation read out on November 1, 1858?",Delhi,Calcutta,Allahabad,Bombay,c
Mangal Pandey is associated with the rebellion of which of the following places?,Delhi,Lucknow,Barrackpore,Kanpur,c
What was the ratio of British to Indian army personnel in India before the revolt of 1857?,1 : 3,1 : 4,1 : 6,1 : 5,d
"Which city, recaptured by the British, is associated with the 1857 revolt?",Lucknow,Delhi,Kanpur,Jhansi,b
The largest number of soldiers participating in the struggle of 1857 came from which region?,Bihar,Jhansi,Awadh,Bengal,c
Who was the first Indian to write about the causes of the revolt of 1857 in an Indian language?,Maulvi Liaquat Ali,Veer Kunwar Singh,Syed Ahmed Khan,Tantya Tope,c
Which of the following events took place in the field of education in the year 1857?,Establishment of Aligarh Muslim University,"Establishment of Calcutta, Madras and Bombay Universities",Introduction of the Wood's Despatch,Establishment of Banaras Hindu University,b
Who stated that the 1857 revolt was the result of a 'Hindu-Muslim conspiracy'?,S. N. Sen,Lord Dalhousie,James Outram,Maulvi Liaquat Ali,c
"Who made the following statement about the incident of 1857: “It was much bigger than a military rebellion, but much less than a first war of independence”?",James Outram,Syed Ahmed Khan,S. N. Sen,Veer Kunwar Singh,c
"By 1857, which location had been the residence of the Mughal emperors of India for nearly 200 years?",Agra Fort,Fatehpur Sikri,Red Fort,Lahore Fort,c
Who led the 1857 rebellion against the British in Allahabad (now Prayagraj)?,Nana Saheb,Tantya Tope,Maulvi Liaquat Ali,Begum Hazrat Mahal,c
"Match the following leaders with their roles during the 1857 revolt:

Column I (Leader) | Column II (Role)
A. Bahadur Shah II | 1. Led the revolt in Kanpur
B. Rani Lakshmi Bai | 2. Mughal ruler at the time of the revolt
C. Nana Saheb | 3. Led the rebellion in Jhansi

Choose the correct sequence:","A-1, B-2, C-3","A-2, B-3, C-1","A-3, B-1, C-2","A-2, B-1, C-3",b
Which of the following statements about Rani Lakshmi Bai is INCORRECT?,She led the rebellion in Jhansi during the Revolt of 1857.,Her original name was Manikarnika.,She was born in Varanasi.,She was buried in Kanpur.,d
Who was Nana Saheb's 'Commander-in-Chief' during the revolt of 1857?,Veer Kunwar Singh,Maulvi Liaquat Ali,Tantya Tope,Bahadur Shah II,c
"Begum Hazrat Mahal, wife of the Nawab of Awadh, led the rebellion in which city?",Allahabad,Kanpur,Lucknow,Jhansi,c
Veer Kunwar Singh led the 1857 revolt in which region?,Lucknow,Delhi,Bihar (Jagdishpur),Kanpur,c
Mangal Pandey is primarily associated with the rebellion at which location?,Delhi,Barrackpore,Lucknow,Kanpur,b
What was the ratio of British to Indian soldiers in the country before the revolt of 1857?,1 : 10,1 : 2,1 : 5,1 : 3,c
"Which city, recaptured by the British, was a key location during the 1857 revolt?",Kanpur,Lucknow,Delhi,Jhansi,c
The largest number of soldiers participating in the 1857 struggle originated from which region?,Bihar,Bengal,Awadh,Jhansi,c
Who was the first Indian to document the causes of the 1857 revolt in an Indian language?,Veer Kunwar Singh,Maulvi Liaquat Ali,Nana Saheb,Syed Ahmed Khan,d
"In what year were the Calcutta, Madras, and Bombay Universities established?",1856,1858,1857,1859,c
The statement that the 1857 revolt was a 'Hindu-Muslim conspiracy' is attributed to whom?,S. N. Sen,Syed Ahmed Khan,James Outram,Maulvi Liaquat Ali,c
"Who described the incident of 1857 as 'much bigger than a military rebellion, but much less than a first war of independence'?",James Outram,Syed Ahmed Khan,S. N. Sen,Bahadur Shah II,c
"By 1857, which landmark had served as the residence of the Mughal emperors for nearly 200 years?",Agra Fort,Red Fort,Fatehpur Sikri,Lahore Fort,b
"Match the following leaders with the locations they led the revolt in:

Column I (Leader)         Column II (Location)
A. Rani Lakshmi Bai      1. Kanpur
B. Nana Saheb                2. Lucknow
C. Begum Hazrat Mahal   3. Jhansi

Choose the correct sequence:","A-3, B-1, C-2","A-2, B-3, C-1","A-1, B-2, C-3","A-3, B-2, C-1",a
Who among the following was the Mughal ruler at the time of the revolt of 1857?,Akbar,Shah Jahan,Bahadur Shah II,Aurangzeb,c
Which of the following statements is INCORRECT regarding Rani Lakshmi Bai?,She led the rebellion in Jhansi.,Her original name was Manikarnika.,She was buried in Gwalior.,She led the revolt in Allahabad.,d
Tantya Tope held which position in relation to Nana Saheb?,Advisor,Commander-in-Chief,Finance Minister,Personal Guard,b
"In May 1857, who led the rebellion in Lucknow as the wife of the Nawab of Awadh?",Rani Lakshmi Bai,Begum Hazrat Mahal,Manikarnika,Ahilyabai Holkar,b
Mangal Pandey is most closely associated with which of the following locations during the 1857 rebellion?,Delhi,Lucknow,Barrackpore,Kanpur,c
"Which city, recaptured by the British, was central to the 1857 revolt?",Allahabad,Kanpur,Delhi,Lucknow,c
The largest contingent of soldiers participating in the 1857 struggle originated from which region?,Bihar,Jhansi,Awadh,Bengal,c
Which of the following educational institutions were established in 1857?,"Calcutta, Madras, and Bombay Universities",Aligarh Muslim University,Banaras Hindu University,Allahabad University,a
Who made the statement that the 1857 revolt was the result of a 'Hindu-Muslim conspiracy'?,S.N. Sen,Lord Dalhousie,James Outram,Maulvi Liaquat Ali,c
"Who described the 1857 incident as 'much bigger than a military rebellion, but much less than a first war of independence'?",James Outram,Syed Ahmed Khan,S. N. Sen,Veer Kunwar Singh,c
"By 1857, which location had served as the residence of the Mughal emperors of India for approximately 200 years?",Agra Fort,Fatehpur Sikri,Red Fort,Lahore Fort,c
"Match the following leaders with their respective roles during the 1857 revolt:

Column I (Leader)  Column II (Role)
A. Bahadur Shah II   1. Led the revolt in Kanpur
B. Nana Saheb   2. Leader of the revolt in Allahabad
C. Maulvi Liaquat Ali  3. Mughal ruler at the time of the revolt

Choose the correct sequence:","A-3, B-1, C-2","A-2, B-3, C-1","A-1, B-2, C-3","A-3, B-2, C-1",a
Rani Lakshmi Bai led the rebellion in Jhansi. What was her original name?,Ahilyabai,Manikarnika,Indira,Padmavati,b
Who was Nana Saheb's 'Commander-in-Chief' during the 1857 revolt?,Veer Kunwar Singh,Maulvi Liaquat Ali,Tantya Tope,Bahadur Shah II,c
"In May 1857, who, as the wife of the Nawab of Awadh, led the rebellion in Lucknow?",Rani Lakshmi Bai,Begum Hazrat Mahal,Ahilyabai Holkar,Jodha Bai,b
Mangal Pandey is primarily associated with which of the following locations during the 1857 revolt?,Kanpur,Barrackpore,Lucknow,Jhansi,b
"Prior to the revolt of 1857, what was the approximate ratio of British to Indian soldiers in the army?",1 : 10,1 : 5,1 : 2,1 : 3,b
Which city was recaptured by the British after the 1857 revolt?,Lucknow,Kanpur,Delhi,Jhansi,c
What significant event in the field of education occurred in the year 1857?,Establishment of Banaras Hindu University,Introduction of the Charter Act,"Establishment of Calcutta, Madras, and Bombay Universities",Founding of the Aligarh Muslim University,c
Which of the following statements is attributed to James Outram regarding the 1857 revolt?,It was solely a military rebellion.,It was a Hindu-Muslim conspiracy.,It was the first war of independence.,It was a peasant uprising.,b
S.N. Sen described the 1857 incident with which of the following statements?,It was purely a sepoy mutiny.,"It was much bigger than a military rebellion, but much less than a first war of independence.",It was solely a peasant revolt.,It was a conspiracy of the aristocracy.,b
"By 1857, which site had served as the residence for the Mughal emperors of India for approximately 200 years?",Agra Fort,Lahore Fort,Red Fort,Fatehpur Sikri,c
"Match the following leaders with their roles during the 1857 revolt:

Column I
(A) Bahadur Shah II
(B) Rani Lakshmi Bai
(C) Nana Saheb
(D) Begum Hazrat Mahal

Column II
(1) Led the revolt in Kanpur
(2) Mughal ruler at the time of the revolt
(3) Led the revolt in Jhansi
(4) Led the rebellion in Lucknow

Choose the correct sequence:","A-1, B-2, C-3, D-4","A-2, B-3, C-1, D-4","A-4, B-3, C-2, D-1","A-3, B-2, C-4, D-1",b
Veer Kunwar Singh led the 1857 revolt in which of the following regions?,Kanpur,Lucknow,Jagdishpur (Bihar),Jhansi,c
Who called the 1857 revolt 'India's First War of Independence'?,Maniram Dutt,Bahadur Shah II,V.D. Savarkar,Sidhu Murmu,c
In which year did Rani Lakshmibai attain martyrdom while fighting the British?,1856,1857,1858,1859,c
In which location did Rani Lakshmibai die fighting the British?,Meerut,Jhansi,Gwalior,Ranchi,c
In which year did India come under the direct rule of the British Empire?,1856,1857,1858,1859,c
The Empress's Proclamation of 1858 reestablished which right?,Right to property,Right to education,Right to adopt a second heir,Right to freedom of speech,c
Who was the Mughal ruler whose contribution was seen in the revolt of 1857?,Akbar,Shah Jahan,Bahadur Shah II,Aurangzeb,c
"The Indian Rebellion of 1857 began in Meerut on May 10, 1857 and ended in Gwalior on which date?","June 10, 1858","June 20, 1858","July 10, 1858","July 20, 1858",b
Who was the leader of the 'Santhal Rebellion' (1855-56)?,Tirot Singh,Birsa Munda,Sidhu Murmu,Velu Thampi,c
Who led the Khasi tribal rebellion against the British in 1829?,Sidhu Murmu,Tirot Singh,Birsa Munda,Alluri Sitarama Raju,b
In which location did the Moplah rebellion (1921) take place?,Bengal,Manipur,Malabar,Ranchi,c
The Sanyasi rebellion primarily broke out in which region?,Kerala,Bengal,Manipur,Andhra Pradesh,b
Who was the leader of the Munda rebellion?,Velu Thampi,Tirot Singh,Sidhu Murmu,Birsa Munda,d
Birsa Munda's field of work was primarily located in which city?,Malabar,Gudem,Ranchi,Meerut,c
The Koliya rebellion was related to the people of which region?,East Godavari,Chota Nagpur,Malabar,Gudem Hills,b
Velu Thampi led the movement against the British in which state?,Manipur,Kerala,Andhra Pradesh,Bengal,b
The Jiyatarang movement started in which state?,Kerala,Bengal,Manipur,Andhra Pradesh,c
The Sanyasi rebellion was sparked in which location?,Malabar,Bengal,Gudem,Ranchi,b
Alluri Sitarama Raju was a tribal freedom fighter from which state?,Kerala,Manipur,Andhra Pradesh,Bengal,c
In which region did the Koya rebellion take place in 1879-1880?,Chota Nagpur,East Godavari,Malabar,Gudem Hills,b
Rani Gaidinliu is associated with which movement?,Santhal,Munda,Heraka,Koliya,c
