Question,Option A,Option B,Option C,Option D,Correct Answer
Which Satyagraha was Mahatma Gandhi's first in 1917 and a major uprising in the Indian independence movement?,Kheda,Bardoli,Champaran,Dandi,c
Who led the Champaran Satyagraha?,Rajendra Prasad,Jawaharlal Nehru,Mahatma Gandhi,Sardar Patel,c
"In June 1904, Gandhiji founded a community-based monastery called __________ outside Durban.",Sabarmati,Sevagram,Phoenix,Wardha,c
Mahatma Gandhi reached South Africa by which steamship?,SS Titanic,SS Safari,SS India,SS Africa,b
In which country did Gandhiji adopt the 'service religion'?,India,England,South Africa,Burma,c
In what year did M.K. Gandhi write 'Hind Swaraj'?,1919,1929,1909,1939,c
"For his contribution to the ambulance services of South Africa, Mahatma Gandhi was awarded the British __________ medal.",Bharat Ratna,Kaiser-i-Hind,Padma Vibhushan,Order of the British Empire,b
In which year did Mahatma Gandhi return his Kaiser-i-Hind medal?,1930,1910,1940,1920,d
In which city did Gandhiji start the campaign to free bonded labourers?,Delhi,Patna,Bombay,Calcutta,b
"According to the text, the power of Satyagraha emphasized the power of what?",Violence,Truth,Political influence,Economic strength,b
Mahatma Gandhi presided over how many sessions of the Indian National Congress?,Do (Two),Teen (Three),Ek (One),Char (Four),c
"In which year was the Champaran Satyagraha, Mahatma Gandhi's first Satyagraha?",1927,1907,1937,1917,d
Who advised Gandhi to travel to British India to learn about the land and its people?,M.K. Gandhi,Lord Hardinge,Gopal Krishna Gokhale,Karamchand Gandhi,c
'Gokhale My Political Guru' is written by whom?,Gopal Krishna Gokhale,Lord Hardinge,Karamchand Gandhi,M. K. Gandhi,d
M.K. Gandhi was a supporter of what?,Theocracy,Monarchy,Philosophical anarchism,Oligarchy,c
What was the name of the magazine published by Mahatma Gandhi during his time in South Africa?,Young India,Harijan,Indian Opinion,Navajivan,c
"In June 1904, Gandhiji founded a community-based monastery outside Durban named what?",Sabarmati,Sevagram,Phoenix,Wardha,c
Mahatma Gandhi was awarded the British 'Kaiser-i-Hind' medal for his contribution to which services?,Educational services,Ambulance services of South Africa,Agricultural services,Legal services,b
Which Indian National Congress session marked the first time M.K. Gandhi attended?,"Lahore Session, 1929","Calcutta Session, 1901","Karachi Session, 1931","Belgaum Session, 1924",b
"According to Gandhi, what power did Satyagraha emphasize?",Military might,Political influence,Economic strength,Truth,d
"In Gandhiji's view, non-violence signifies what?",A sign of weakness,The path to attaining truth,A tool for negotiation,Passive resistance,b
How many sessions of the Indian National Congress did Mahatma Gandhi preside over?,Two,Three,One,None,c
In which year did the Champaran Satyagraha take place?,1924,1930,1917,1942,c
"In June 1904, Gandhiji founded a community-based monastery called __________ basti outside Durban.",Varanasi,Phoenix,Champaran,Sabarmati,b
Where did Gandhiji initiate the campaign to free bonded laborers?,Durban,Patna,Champaran,Calcutta,b
What did the power of Satyagraha emphasize?,Military strength,Political influence,Truth,Economic power,c
"According to Gandhiji, what does non-violence signify?",A sign of weakness,The path to attaining truth,A means of avoiding conflict at all costs,Passive resistance,b
'Satyagraha' was coined by whom?,Lord Hardinge,Gopal Krishna Gokhale,Karamchand Gandhi,Mahatma Gandhi,d
In which session of the Indian National Congress was Mahatma Gandhi made aware of the problems of the farmers of Champaran?,"Surat Session, 1907","Lucknow Session, 1916","Calcutta Session, 1911","Bombay Session, 1915",b
What was the meaning of 'Tinkathia system' in Champaran?,1/10 of the land,1/4 of the land,3/20 of the land,1/3 of the land,c
Against what cause did Gandhiji start his first Satyagraha in Ahmedabad?,High taxes on farmers,Low wages to workers,Forced indigo cultivation,British land policies,b
In which movement did Mahatma Gandhi first use hunger strike as a weapon?,Champaran Satyagraha,Kheda Satyagraha,Non-Cooperation Movement,Ahmedabad strike,d
Who opposed Mahatma Gandhi's Champaran Satyagraha?,Rajendra Prasad,Anugrah Narayan Sinha,N. G. Ranga,Gopal Krishna Gokhale,c
During which event was the name 'Mahatma' added before Gandhiji's name?,Kheda Satyagraha,Ahmedabad strike,Champaran Satyagraha,Dandi March,c
What were Gandhiji's twin principles of Ram Rajya?,Peace and prosperity,Power and Justice,Truth and non-violence,Equality and Fraternity,c
Which prison did Gandhiji call a temple?, cellular Jail,Yerwada,Arthur Road Jail,Alipore Central Jail,b
What does 'Gandhian Innovation' mean?,High output for fewer people with more investment,More output for more people with less investment,Less output for more people with more investment,High output for all people regardless of investment,b
"According to M.K. Gandhi, how can the socio-economic reform of the untouchables be achieved?",By providing them with government jobs,By establishing cottage industries for them,By giving them free education,By abolishing the caste system,b
What is the last step in Gandhi's Satyagraha strategy?,Non-cooperation,Civil disobedience,Negotiation,Fasting,d
With which of the following movements is Mahatma Gandhi NOT directly related?,Champaran Satyagraha,Home Rule Movement,Non-Cooperation Movement,Civil Disobedience Movement,b
Who founded the Harijan Sevak Sangh?,B. R. Ambedkar,Mahatma Gandhi,Jawaharlal Nehru,Sardar Vallabhbhai Patel,b
Who advocated a decentralized economy?,Jawaharlal Nehru,Indira Gandhi,Mahatma Gandhi,Rajiv Gandhi,c
"According to Mahatma Gandhi, what was “a symbol of the unity of Indian humanity , its economic independence and equality”?",The spinning wheel,Khadi,Swaraj,Non-violence,b
Who ordered Mahatma Gandhi to spend his first year in India with his ears open and mouth shut?,Rajendra Prasad,Jawaharlal Nehru,Gopal Krishna Gokhale,Sardar Vallabhbhai Patel,c
What did the 'Tinkathia system' signify in Champaran?,1/4 of the land,1/2 of the land,3/20 of the land,1/3 of the land,c
Against what was Gandhiji's first Satyagraha primarily directed?,High land taxes,Low wages to workers,Forced indigo cultivation,Untouchability,b
In which movement did Mahatma Gandhi first employ the hunger strike as a weapon?,Champaran Satyagraha,Kheda Satyagraha,Non-Cooperation Movement,Ahmedabad strike,d
Who supported Mahatma Gandhi in the Champaran struggle?,Jawaharlal Nehru and Sardar Patel,Rajendra Prasad and Anugrah Narayan Sinha,Subhas Chandra Bose and C.R. Das,Motilal Nehru and Annie Besant,b
"According to Gandhiji, what were the twin principles of Ram Rajya?",Justice and Equality,Peace and Prosperity,Truth and Non-violence,Freedom and Democracy,c
Which prison did Gandhiji refer to as a temple?, cellular jail,Tihar Jail,Yerwada,Arthur Road Jail,c
What does 'Gandhian Innovation' signify?,High output for few people with maximum investment,Low output for many people with high investment,More output for more people with less investment,Less output for less people with high investment,c
"According to Mahatma Gandhi, what did politics mean?",Gaining political power,Activism for public welfare,Maintaining social order,Upholding traditional values,b
With which movement is Mahatma Gandhi NOT related?,Champaran Satyagraha,Home Rule Movement,Non-Cooperation Movement,Quit India Movement,b
Who called Khadi the uniform of freedom?,Jawaharlal Nehru,Subhas Chandra Bose,Mahatma Gandhi,Sardar Vallabhbhai Patel,c
In which Indian National Congress session was Mahatma Gandhi informed about the problems of Champaran farmers?,"Surat Session, 1907","Lucknow Session, 1916","Calcutta Session, 1911","Bombay Session, 1915",b
Against what issue did Gandhiji initiate his first Satyagraha in Ahmedabad?,Land revenue policies,Low wages to workers,Salt tax,Untouchability,b
In which movement did Mahatma Gandhi first employ the hunger strike as a strategic tool?,Champaran Satyagraha,Kheda Satyagraha,Ahmedabad strike,Non-Cooperation Movement,c
Who among the following opposed Mahatma Gandhi's Champaran Satyagraha?,Rajendra Prasad,Anugrah Narayan Sinha,N. G. Ranga,Gopal Krishna Gokhale,c
During which event was the title 'Mahatma' prefixed to Gandhiji's name?,Kheda Satyagraha,Non-Cooperation Movement,Champaran Satyagraha,Dandi March,c
"According to M.K. Gandhi, how can socio-economic reform of the untouchables be achieved?",By providing them with government jobs,By establishing cottage industries for them,By giving them reservation in education,By providing them with free housing,b
What is the final step in Gandhi's Satyagraha strategy?,Negotiation,Non-cooperation,Civil disobedience,Fasting,d
Which of the following movements is Mahatma Gandhi NOT directly associated with?,Champaran Satyagraha,Home Rule Movement,Khilafat Movement,Non-Cooperation Movement,b
"According to Mahatma Gandhi, what symbolized the unity of Indian humanity, its economic independence, and equality?",The spinning wheel,Khadi,The village panchayat,The national flag,b
Who advised Mahatma Gandhi to spend his first year in India with his ears open and mouth shut?,Jawaharlal Nehru,Sardar Vallabhbhai Patel,Gopal Krishna Gokhale,Rajendra Prasad,c
In which movement did Mahatma Gandhi first employ hunger strike as a weapon?,Champaran Satyagraha,Kheda Satyagraha,Ahmedabad strike,Non-Cooperation Movement,c
During which Satyagraha was the name 'Mahatma' added before Gandhiji's name?,Kheda Satyagraha,Ahmedabad strike,Champaran Satyagraha,Salt Satyagraha,c
What is the last element in Gandhi's Satyagraha strategy?,Non-cooperation,Negotiation,Civil disobedience,Fasting,d
"According to Mahatma Gandhi, what did politics signify?",Acquisition of power,Activism for public welfare,Diplomacy and negotiation,Electoral competition,b
"For Mahatma Gandhi, what was considered “a symbol of the unity of Indian humanity, its economic independence and equality”?",Salt,Khadi,Charkha,Agriculture,b
Who among the following opposed Mahatma Gandhi's joining the Khilafat Movement?,Vallabhbhai Patel,Muhammad Ali Jinnah,Rabindranath Tagore,Sir Shankar Nair,b
"Arrange the following movements led by Mahatma Gandhi in chronological order:
   1. Dandi
   2. Non-cooperation
   3. Champaran","3, 2, 1","2, 3, 1","1, 2, 3","3, 1, 2",a
Who gave Vallabhbhai Patel the title of 'Sardar'?,Mahatma Gandhi,The British Government,The women of Bardoli,The Congress Inquiry Committee,c
The Jallianwala Bagh massacre took place in which city?,Delhi,Lahore,Amritsar,Bardoli,c
Which of the following statements is INCORRECT regarding the Rowlatt Act of 1919?,It included indefinite detention without trial.,It included censorship of the press.,Mahatma Gandhi launched Satyagraha against it.,It was passed in 1920.,d
Which day was observed as National Humiliation Day as a reaction to the Rowlatt Act?,"April 13, 1919","February 6, 1919","April 6, 1919","February 13, 1919",c
In which year was the Satyagraha Sabha established by Mohandas Karamchand Gandhi?,February 1919,April 1919,1915,1920,a
"In protest against the Jallianwala Bagh massacre, who resigned from the Viceroy's Executive Council?",Mahatma Gandhi,Rabindranath Tagore,Muhammad Ali Jinnah,Sir Shankar Nair,d
Rabindranath Tagore returned the title 'Sir' to the British government in which year?,1915,1917,1919,1920,c
To whom was the task of drafting the report of the Congress Inquiry Committee on the Jallianwala Bagh massacre assigned?,Vallabhbhai Patel,Muhammad Ali Jinnah,Mahatma Gandhi,Sir Shankar Nair,c
Arrange the following movements led by Mahatma Gandhi in chronological order:,"Non-cooperation, Champaran, Dandi","Champaran, Dandi, Non-cooperation","Dandi, Non-cooperation, Champaran","Champaran, Non-cooperation, Dandi",d
Vallabhbhai Patel was given the title of 'Sardar' by whom?,Mahatma Gandhi,The British Government,The women of Bardoli,The Congress Inquiry Committee,c
The Rowlatt Act and the Jallianwala Bagh incident forced people to gather at Jallianwala Bagh in which city?,Bardoli,Delhi,Amritsar,Lahore,c
Gandhi's campaign against British censorship of the press and detention without trial was in response to which act?,"The Government of India Act, 1919",The Rowlatt Act,The Khilafat Movement,The Dandi March,b
"Which of the following was NOT included in the Rowlatt Act, 1919?",Indefinite detention without trial,Censorship of the press,Right to appeal in court,Imprisonment without trial,c
"The phrase 'no argument, no lawyer, no appeal' is related to which of the following?",The Non-cooperation Movement,The Rowlatt Act,The Dandi March,"The Government of India Act, 1919",b
In which year did Mahatma Gandhi launch Satyagraha against the Rowlatt Act?,1920,1917,1919,1930,c
Against which act did Mahatma Gandhi ask people to demonstrate non-violent protest on 6 April 1919?,"The Government of India Act, 1919",The Rowlatt Act,The Khilafat Act,The Dandi Act,b
"As a reaction to the Rowlatt Act, which day was observed as National Humiliation Day?","April 13, 1919","February 14, 1919","April 6, 1919","March 12, 1919",c
"In February 1919, the Satyagraha Sabha was established by whom?",Muhammad Ali Jinnah,Vallabhbhai Patel,Rabindranath Tagore,Mohandas Karamchand Gandhi,d
When did Mahatma Gandhi found the Satyagraha Sabha?,In April 1919,In February 1919,In March 1920,In January 1918,b
The Jallianwala Bagh massacre took place on which date?,"April 6, 1919","February 14, 1919","April 13, 1919","March 12, 1919",c
Who was assigned the task of drafting the report of the Congress Inquiry Committee on the Jallianwala Bagh massacre?,Jawaharlal Nehru,Vallabhbhai Patel,Mahatma Gandhi,Rabindranath Tagore,c
Who resigned from the Viceroy's Executive Council in protest against the Jallianwala Bagh massacre?,Mahatma Gandhi,Jawaharlal Nehru,Sir Shankar Nair,Vallabhbhai Patel,c
In which year did Rabindranath Tagore return the title of 'Sir' to the British government?,1915,1920,1919,1917,c
Which measure was adopted under the Rowlatt Act?,Free and fair trial,Imprisonment with legal aid,Imprisonment without trial,Censorship with right to appeal,c
Who opposed Mahatma Gandhi's joining the Khilafat Movement?,Vallabhbhai Patel,Jawaharlal Nehru,Muhammad Ali Jinnah,Rabindranath Tagore,c
The Rowlatt Act and Jallianwala Bagh events forced people to gather at Jallianwala Bagh in which city?,Delhi,Lahore,Amritsar,Calcutta,c
Gandhi's campaign against which of the following was in response to British censorship of the press and detention without trial?,The Salt Tax,The Rowlatt Act,The Government of India Act,The Simon Commission,b
The Rowlatt Act of 1919 included which of the following?,Immediate Independence,Indefinite detention without trial and censorship of the press,Free and compulsory education,Universal adult franchise,b
"Against which Act did Mahatma Gandhi ask people to demonstrate non-violent protest on April 6, 1919?",The Arms Act,The Rowlatt Act,The Vernacular Press Act,The Sedition Act,b
"In 1919, Gandhiji called for Satyagraha, against which the British passed which act?",The Charter Act,The Regulating Act,The Rowlatt Act,The Pitt's India Act,c
The task of drafting the report of the Congress Inquiry Committee on the Jallianwala Bagh massacre was assigned to whom?,Jawaharlal Nehru,Mahatma Gandhi,Motilal Nehru,C.R. Das,b
"In which year was Rabindranath Tagore given the title of 'Sir' by the British government, which he returned after the Jallianwala Bagh massacre?",1920,1910,1915,1925,c
"Under the Rowlatt Act, which measure was adopted?",Free Education,Universal Suffrage,Imprisonment without trial,Freedom of Press,c
"Arrange the following movements led by Mahatma Gandhi in chronological order: (I) Dandi, (II) Non-cooperation, (III) Champaran.","I, II, III","III, II, I","II, III, I","III, I, II",b
The title of 'Sardar' was given to Vallabhbhai Patel by whom?,Mahatma Gandhi,The women of Bardoli,Jawaharlal Nehru,The British Government,b
"Which Act forced people to gather at Jallianwala Bagh, Amritsar?",Indian Councils Act 1909,Government of India Act 1919,Rowlatt Act,Arms Act,c
"Which of the following was included in the Rowlatt Act, 1919?",Introduction of Dyarchy,Complete press freedom,Indefinite detention without trial and censorship of the press,Establishment of Provincial Autonomy,c
Against which act were people asked to demonstrate non-violent protest on 6 April 1919?,Pitt's India Act,Rowlatt Act,Regulating Act,Indian Councils Act,b
"In 1919, Gandhiji called for Satyagraha against which act passed by the British?",Indian Independence Act,Rowlatt Act,"Government of India Act, 1935",Simon Act,b
The Satyagraha Sabha was established in February 1919 by whom?,Jawaharlal Nehru,Subhas Chandra Bose,Mohandas Karamchand Gandhi,Sardar Vallabhbhai Patel,c
In which month and year was the Satyagraha Sabha founded by Mahatma Gandhi?,March 1920,February 1919,April 1918,January 1917,b
In which year did Rabindranath Tagore return the 'Sir' title given to him by the British government?,1914,1915,1918,1919,d
"Under the Rowlatt Act, which of the following measures was adopted?",Introduction of elections,Imprisonment without trial,Granting of dominion status,Freedom of press,b
In which year was the Rowlatt Act passed?,1929,1910,1919,1920,c
"Who accompanied Bhagat Singh in throwing a bomb in the Central Legislative Assembly on April 8, 1929?",Ashfaqullah Khan,Ram Prasad 'Bismil',B.K. Dutt (Batukeshwar Dutt),Lala Hardayal,c
In which city was the Communist Party of India (CPI) founded in 1920?,Allahabad,Faizabad,Tashkent,Muzaffarpur,c
Who planned the Kakori train robbery along with Ram Prasad 'Bismil'?,Bhagat Singh,Chandrashekhar Azad,Lala Hardayal,Ashfaqullah Khan,d
Against whom was the Central Assembly Bomb Case (1929) filed?,Bhagat Singh,Ashfaqullah Khan,Batukeshwar Dutt,Ram Prasad 'Bismil',c
Bhagat Singh and his friends were arrested for which of the following?,Kakori train robbery,Bastar rebellion,Central Assembly bomb case,Assassination attempt on Judge Kingsford,c
Which secret organization carried out armed movements for independence?,Hindustan Republican Association,Abhinav Bharat Samaj,Yugantar Party,Ghadar Rebellion Party,c
In which country was the Ghadar Rebellion Party founded?,India,England,America,Russia,c
In which year did the Bastar rebellion start in Central India?,1929,1919,1908,1910,d
In which jail was Ashfaqulla Khan imprisoned after being caught in the Kakori case?,Allahabad,Faizabad,Muzaffarpur,Tashkent,b
Which revolutionary organization was involved in the Kakori conspiracy case?,Yugantar Party,Abhinav Bharat Samaj,Hindustan Republican Association,Ghadar Rebellion Party,c
In which years were the two Home Rule Leagues started?,1910-11,1915-16,1920-21,1908-09,b
Who made an attempt to assassinate Judge Kingsford in Muzaffarpur in 1908?,Bhagat Singh and Sukhdev,Prafulla Chaki and Khudiram Bose,Ashfaqullah Khan and Ram Prasad 'Bismil',Lala Hardayal and Bhagwati Charan Vohra,b
"In which year were Bhagat Singh, Sukhdev and Rajguru sentenced to death?",1929,1930,1931,1932,c
Who founded the revolutionary organization 'Abhinav Bharat Samaj'?,Lala Hardayal,Vinayak Damodar Savarkar,Chandrashekhar Azad,Bhagwati Charan Vohra,b
Where did Chandrashekhar Azad shoot himself when cornered by the British police?,Faizabad,Muzaffarpur,Allahabad,Tashkent,c
Who wrote the famous article 'The Philosophy of the Bomb'?,Lala Hardayal,Bhagat Singh,Chandrashekhar Azad,Bhagwati Charan Vohra,d
Who was the leader of the Ghadar Movement?,Vinayak Damodar Savarkar,Lala Hardayal,Ashfaqullah Khan,Khudiram Bose,b
For which case was Batukeshwar Dutt known?,Kakori Train Robbery,Central Assembly Bomb Case (1929),Bastar Rebellion,Muzaffarpur Assassination Attempt,b
What was the reason for Bhagat Singh and his friends' arrest?,Kakori train robbery,Ghadar Rebellion,Central Assembly bomb case,Bastar rebellion,c
Where was the Ghadar Rebellion Party founded?,In India,In Tashkent,In Faizabad,In America,d
Where was Ashfaqulla Khan imprisoned after being caught in the Kakori case?,In Allahabad,In Faizabad jail,In Muzaffarpur,In Tashkent,b
Who led the two Home Rule Leagues started in 1915-16?,Annie Besant and Lala Hardayal,Annie Besant and Lokmanya Tilak,Bhagat Singh and Sukhdev,Rajguru and Chandrashekhar Azad,b
Who attempted to assassinate Judge Kingsford in Muzaffarpur in 1908?,Bhagat Singh and Sukhdev,Rajguru and Ashfaqulla Khan,Prafulla Chaki and Khudiram Bose,Annie Besant and Lokmanya Tilak,c
"In what year were Bhagat Singh, Sukhdev, and Rajguru sentenced to death?",1919,1929,1931,1910,c
In which city did Chandrashekhar Azad shoot himself when cornered by the British police?,Faizabad,Muzaffarpur,Allahabad,Tashkent,c
On which date did Bhagat Singh and B.K. Dutt throw a bomb in the Central Legislative Assembly?,"April 18, 1929","April 6, 1929","April 8, 1929","April 10, 1929",c
Who was the associate of Bhagat Singh who threw a bomb in the Central Legislative Assembly?,Ashfaqullah Khan,Ram Prasad 'Bismil',Batukeshwar Dutt,Lala Hardayal,c
Which freedom fighter was implicated in the Central Assembly Bomb Case (1929)?,Bhagat Singh,Ashfaqullah Khan,Batukeshwar Dutt,Lala Hardayal,c
For what were Bhagat Singh and his friends arrested?,Kakori train robbery,Ghadar Rebellion,Central Assembly bomb case,Bastar rebellion,c
Which secret organization is known for carrying out armed movements for independence?,Hindustan Republican Association,Abhinav Bharat Samaj,Yugantar Party,Communist Party of India,c
Where was the Ghadar Rebellion Party founded by Indian revolutionaries?,Germany,America,Russia,India,b
In which region of India did the Bastar rebellion start in the year 1910?,Central India,Northern India,Southern India,Eastern India,a
Who led the two Home Rule Leagues that were started in 1915-16?,Annie Besant and Mahatma Gandhi,Lokmanya Tilak and Jawaharlal Nehru,Annie Besant and Lokmanya Tilak,Mahatma Gandhi and Jawaharlal Nehru,c
"In Muzaffarpur, who attempted to assassinate Judge Kingsford in 1908?",Bhagat Singh and Sukhdev,Prafulla Chaki and Khudiram Bose,Rajguru and Chandrashekhar Azad,Ashfaqullah Khan and Ram Prasad 'Bismil',b
"Besides Ram Prasad 'Bismil', who else planned the Kakori train robbery?",Bhagat Singh,Batukeshwar Dutt,Chandrashekhar Azad,Ashfaqullah Khan,d
For which case was Batukeshwar Dutt filed against?,Kakori Train Robbery,Central Assembly Bomb Case (1929),Ghadar Conspiracy,Muzaffarpur Conspiracy,b
The Ghadar Rebellion Party was founded by Indian revolutionaries in which country?,Germany,England,America,Russia,c
In which region of India did the Bastar rebellion start in 1910?,Bengal,Central India,Punjab,Madras,b
"Jatin Das died in jail after fasting for how many days, demanding to be treated as a political prisoner?",46 days,54 days,64 days,74 days,c
In which year did Khudiram Bose and Prafulla Chaki attempt to kill a British judge in Muzaffarpur?,1918,1906,1908,1910,c
Who founded the Free India Society?,Bhagat Singh,V.D. Savarkar,Chandrashekhar Azad,Raja Mahendra Pratap,b
The Komagatamaru incident is most closely associated with which of the following?,The start of the Quit India Movement,The Jallianwala Bagh Massacre,The start of the Ghadar Revolution,The Kakori Conspiracy,c
In which city was Chandrashekhar Azad martyred?,Delhi,Kanpur,Allahabad (Prayagraj),Lucknow,c
Which Indian prince played an active role as a revolutionary both within and outside India?,Maharaja Ranjit Singh,Raja Mahendra Pratap,Shivaji Maharaj,Tipu Sultan,b
What was the name of the organization called in Maharashtra in 1900?,Deccan Education Society,Mitra Mela,Servants of India Society,Anushilan Samiti,b
"Who led the revolutionaries who captured the police armoury located at Dapara on April 18, 1930?",Ganesh Ghosh,Bhagat Singh,Surya Sen,Chandrashekhar Azad,c
Which freedom fighter founded the 'Naujwan Bharat Sabha'?,Sukhdev,Rajguru,Bhagat Singh,Ashfaqullah Khan,c
Bhagat Singh and Batukeshwar Dutt threw smoke bombs at the Delhi Central Assembly protesting against which bills?,Rowlatt Act and Vernacular Press Act,Trade Disputes Bill and Public Safety Bill,Ilbert Bill and Arms Act,Pitt's India Act and Regulating Act,b
"Who delivered a speech on Hindu-Muslim unity from the pulpit of Jama Masjid in Delhi on April 4, 1919?",Mahatma Gandhi,Swami Vivekananda,Swami Shraddhanand,Maulana Azad,c
Who was shot dead for failing to check the plague in Poona in the late 19th century?,Lord Curzon,Rand,Lord Dalhousie,Lord William Bentinck,b
The Young Bengal Movement was started by whom?,David Hare,Dwarkanath Tagore,Henry Vivian Derozio,Ram Mohan Roy,c
Who was involved in the Alipore bomb incident?,Subhas Chandra Bose,Shri Aurobindo Ghosh,Jatin Das,Rash Behari Bose,b
"In 1928, where was the Hindustan Socialist Republican Army founded in Delhi?",India Gate,Red Fort,Feroz Shah Kotla Ground (New Delhi),Jantar Mantar,c
"Ram Prasad Bismil, Chandrashekhar Azad and Bhagat Singh were associated with which organization?",Indian National Congress,Ghadar Party,Hindustan Socialist Republican Association,Anushilan Samiti,c
Which of the following statements is INCORRECT regarding the revolutionaries mentioned in the text?,V.D. Savarkar founded the Free India Society.,Bhagat Singh was associated with the Hindustan Socialist Republican Association.,Khudiram Bose attempted to kill a British judge in Muzaffarpur in 1908.,Raja Mahendra Pratap was only active as a revolutionary within India.,d
In which year did Khudiram Bose and Prafulla Chaki attempt to assassinate a British judge in Muzaffarpur?,1910,1905,1908,1912,c
The Komagatamaru incident is associated with which event?,The Alipore bomb incident,The start of the Ghadar Revolution,The Young Bengal Movement,The Trade Disputes Bill,b
"Mitra Mela, founded in Maharashtra in 1900, was called what?",Hindustan Republican Association,Free India Society,Mitra Mandal,Mitra Mela,d
Who led the revolutionaries that captured the police armoury located at Dapara on 18 April 1930?,Bhagat Singh,Ganesh Ghosh,Surya Sen,Chandrashekhar Azad,c
