Question,Option A,Option B,Option C,Option D,Correct Answer
The Hathigumpha inscription is associated with which king of Kalinga?,Pushyamitra Shunga,Agnimitra,Kanishka,Kharavela,d
Who founded the Satavahana dynasty?,Kanishka,Pushyamitra,Simuka,Rudradaman,c
The Hathigumpha inscription serves as a primary source of information about whom?,Pushyamitra Shunga,Rudradaman I,Kharavela,Kanishka,c
Which dynasty is considered the oldest among the given options?,Kushana,Shunga,Maurya,Satavahana,d
"Following the Mauryas, which state held the most influential position in South India?",Kushana,Shunga,Satavahana,Kalinga,c
At which location was the capital of the Satavahanas situated?,Kathiawar,Udayagiri,Amaravati,Sarnath,c
During whose reign did Buddha's depiction on coins first appear?,Pushyamitra Shunga,Rudradaman I,Simuka,Kanishka,d
Panini and Patanjali are famous names from which dynasty's time?,Maurya dynasty,Kushana dynasty,Shunga dynasty,Satavahana dynasty,c
In which year did Vikram Samvat start?,78 AD,81 CE,58 BCE,1st Century BCE,c
Who assassinated the last Mauryan emperor Brihadratha?,Kanishka,Rudradaman I,Simuka,Pushyamitra,d
"Match the following dynasties with their founders:

Column I (Dynasty) 		 Column II (Founder)
A. Satavahana Dynasty 	 1. Pushyamitra Shunga
B. Shunga Dynasty 		 2. Simuka

Which of the following is the correct matching?","A-1, B-2","A-2, B-1","A-1, B-1","A-2, B-2",b
Which of the following statements is INCORRECT regarding Kanishka?,He was a great patron of Buddhism.,He organized the Fourth Buddhist Council.,Buddha's depiction on coins occurred during his reign.,He ruled over Manipur.,d
Who was the founder of the Shunga dynasty?,Kharavela,Pushyamitra,Gautamiputra Satakarni,Rudradaman,b
The Hathigumpha inscription was inscribed by which ruler?,Gautamiputra Satakarni,Pushyamitra,Kharavela,Rudradaman I,c
For whom has 'Eka Brahmana' been used?,Pushyamitra,Kharavela,Rudradaman,Gautamiputra Satakarni,d
"Match the following dynasties with their respective rulers:

Column I
(A) Demetrius
(B) Rudradaman
(C) Gondophernes
(D) Vima

Column II
(1) Shaka
(2) Kushana
(3) Indo-Greek
(4) Parthian

Choose the correct sequence:","A-3, B-1, C-4, D-2","A-1, B-2, C-3, D-4","A-4, B-3, C-2, D-1","A-2, B-4, C-1, D-3",a
The 'Garuda Pillar' was built by Heliodorus near Vidisha in which present-day state?,Odisha,Madhya Pradesh,Gujarat,Uttar Pradesh,b
Which of the following addressed our country as 'India'?,Shakas,Parthians,Greeks,Kushanas,c
Which Indo-Greek ruler issued lead coins?,Demetrius,Strato II,Gondophernes,Heliodorus,b
Who is credited with first issuing gold coins?,Strato II,Rudradaman I,Vima Kadphises,Seleucus Nicator,c
The Indian king defeated by Alexander on the banks of the Jhelum was:,Chandragupta Maurya,Seleucus Nicator,Puru (Porus),Pushyamitra,c
Against whom did the women of the 'Indian Republic or State' take up arms after a large number of soldiers were killed?,Seleucus Nicator,Vima Kadphises,Alexander,Rudradaman I,c
Which foreign invader handed over his territories to Chandragupta Maurya?,Alexander,Vima Kadphises,Rudradaman I,Seleucus Nicator,d
Rudradaman I was a Shaka ruler in India during which period?,130-150 AD,57 BCE,458 AD,78 AD,a
"In the Battle of Hydaspes, Alexander defeated:",Seleucus Nicator,Pushyamitra,Porus,Strato II,c
In which year did the first Huna invasion take place?,57 BCE,130 AD,458 AD,78 AD,c
For whom has the term 'Eka Brahmana' been used?,Pushyamitra,Kharavela,Rudradaman,Gautamiputra Satakarni,d
"Match the following dynasties with their rulers:
	 I. Demetrius 		 A. Shaka
	 II. Rudradaman 		 B. Kushana
	 III. Gondophernes 	 C. Indo-Greek
	 IV. Vima 		 D. Parthian
Choose the correct option:","I-C, II-A, III-D, IV-B","I-A, II-B, III-C, IV-D","I-D, II-C, III-B, IV-A","I-B, II-A, III-D, IV-C",a
The 'Garuda Pillar' was built by Heliodorus near Vidisha in:,Uttar Pradesh,Madhya Pradesh,Odisha,Rajasthan,b
Which of the following statements is INCORRECT regarding ancient India?,The Greeks referred to our country as 'India'.,Strato II was an Indo-Greek ruler who issued lead coins.,The founder of the Shunga dynasty was Gautamiputra Satakarni.,Vima Kadphises is credited with first issuing gold coins.,c
Which ruler was defeated by Alexander on the banks of the Jhelum?,Chandragupta Maurya,Seleucus Nicator,Porus,Strato II,c
Against whom did the women of Massaga take up arms?,Seleucus Nicator,Vima Kadphises,Alexander,Pushyamitra,c
Who handed over his territories to Chandragupta Maurya?,Alexander,Porus,Rudradaman I,Seleucus Nicator,d
"Rudradaman I, a Shaka ruler in India, ruled from which period?",150-170 AD,100-120 AD,130-150 AD,170-190 AD,c
The Hathigumpha (Elephant Cave) inscription was inscribed by whom?,Pushyamitra,Heliodorus,Kharavela,Seleucus Nicator,c
"Match the following rulers with their dynasties:

   Ruler          Dynasty
I. Demetrius    A. Shaka
II. Rudradaman  B. Kushana
III. Vima         C. Indo-Greek
IV. Gondophernes D. Parthian

Choose the correct sequence:","I-A, II-B, III-C, IV-D","I-C, II-A, III-B, IV-D","I-C, II-D, III-A, IV-B","I-B, II-A, III-D, IV-C",b
Who built the 'Garuda Pillar' at Besnagar?,Strato II,Vima Kadphises,Heliodorus,Seleucus Nicator,c
Who was the Indo-Greek ruler who issued lead coins?,Vima Kadphises,Demetrius,Strato II,Heliodorus,c
Who was defeated by Alexander on the banks of the Jhelum?,Seleucus Nicator,Rudradaman I,Pushyamitra,Puru (Porus),d
Which 'Indian Republic or State' women took up arms against Alexander after heavy losses?,Magadha,Massaga,Kalinga,Shunga,b
The Shaka ruler in India from 130-150 AD was:,Strato II,Vima Kadphises,Rudradaman I,Seleucus Nicator,c
In which battle did Alexander defeat Porus?,Battle of Kalinga,Battle of Thermopylae,Battle of Hydaspes,Battle of Guagamela,c
When did the first Huna invasion take place?,57 BCE,78 AD,130 AD,458 AD,d
"Match the following rulers with their respective dynasties:

   Ruler            Dynasty
I. Demetrius      A. Shaka
II. Rudradaman     B. Kushana
III. Vima           C. Indo-Greek
IV. Gondophernes  D. Parthian

Choose the correct sequence:","I-A, II-B, III-C, IV-D","I-C, II-A, III-B, IV-D","I-D, II-C, III-B, IV-A","I-B, II-A, III-D, IV-C",b
The 'Garuda Pillar' was built by Heliodorus near which city?,Udayagiri,Besnagar,Vidisha,Mathura,b
Which Indian king was defeated by Alexander on the banks of the Jhelum?,Chandragupta Maurya,Ashoka,Bindusara,Puru (Porus),d
Which 'Indian Republic or State' women took up arms against Alexander after heavy soldier losses?,Magadha,Massaga,Kosala,Vatsa,b
Which Shaka ruler governed in India from 130-150 AD?,Maues,Azes I,Rudradaman I,Gondophernes,c
The Chola king credited with constructing the sixteen-mile-long 'Chola lake' for irrigation was:,Karikala,Rajaraja I,Rajendra I,Pulakeshin II,c
"The land donated to Jain assemblies, according to Chola inscriptions, was termed as:",Shalabhoga,Brahmadeya,Pallichchhandam,Devadana,c
Sangam literature was primarily composed in which language?,Sanskrit,Malayalam,Tamil,Telugu,c
Which dynasty is known for establishing shipping enterprises in Southeast Asia?,Pandya,Chalukya,Chola,Chera,c
The capital city of the Pandya dynasty was:,Mahodayapuram,Kanchi,Thanjavur,Madurai,d
Who is considered the greatest among the early Chola kings?,Rajaraja I,Rajendra I,Parantaka I,Karikala,d
"Pulakeshin II, a Chalukya king, defeated which ruler of Kannauj?",Rajendra I,Karikala,Harsha,Rajaraja I,c
The Sangam text Tolkappiyam is fundamentally based on:,Poetry,Drama,Grammar,Medicine,c
The Tamil text referred to as 'Laghuveda' is:,Silappadikaram,Manimekalai,Tolkappiyam,Kural,d
The author of the epic Silappadikaram was:,Tiruvalluvar,Ilango,Sittalai Sattanar,Karikala,b
At which location was the third Sangam held?,Kanchi,Uraiyur,Madurai,Thanjavur,c
Which of the following Shiva temples was NOT built under the patronage of the Chola rulers?,"Brihadishvara Temple, Thanjavur","Airavatesvara Temple, Darasuram","Gondeshwar Temple, Sinnar",Gangaikonda Cholapuram Temple,c
The famous bronze statue of 'Nataraja' is a prime example of which art form?,Pandya art,Chalukya art,Chola art,Vijayanagara art,c
Which South Indian state was renowned for its naval power?,Chera,Pandya,Chalukya,Chola,d
The Brihadishvara Temple of Thanjavur was commissioned by which Chola ruler?,Rajendra I,Parantaka I,Karikala,Rajaraja I,d
The early Chera kings had their rule over which of the following states?,Andhra Pradesh and Karnataka,Tamil Nadu and Kerala,Karnataka and Kerala,Tamil Nadu and Andhra Pradesh,b
The archaeological site named Goddiproly is located in the state of:,Karnataka,Tamil Nadu,Kerala,Andhra Pradesh,d
The 'Chola lake' constructed for irrigation purposes was approximately how long?,Twelve miles,Eighteen miles,Sixteen miles,Fourteen miles,c
"According to Chola inscriptions, what was the land donated to Jain assemblies called?",Shalabhoga,Brahmadeya,Pallichchhandam,Devadana,c
In which language was Sangam literature primarily composed?,Malayalam,Telugu,Sanskrit,Tamil,d
Which dynasty is known for establishing significant shipping enterprises in Southeast Asia?,Pandya,Chalukya,Chola,Chera,c
Which of the following was the capital of the Pandya dynasty?,Kanchipuram,Thanjavur,Madurai,Mahodayapuram,c
Which of the following statements is NOT correct regarding the early Chera kings?,They ruled the states of Tamil Nadu and Kerala.,The likely language spoken in their kingdom was Malayalam.,Their capital was Madurai.,They were contemporary to the Cholas and Pandyas.,c
The Sangam text Tolkappiyam primarily deals with which subject?,Astronomy,Medicine,Grammar,Mathematics,c
Who is credited as the author of Silappadikaram?,Karikala,Pulakeshin II,Ilango,Rajaraja I,c
In which state is the archaeological site of Goddiproly located?,Karnataka,Tamil Nadu,Andhra Pradesh,Kerala,c
Which Shiva temple was NOT built under the patronage of the Chola rulers?,"Brihadishvara Temple, Thanjavur","Gondeshwar Temple, Sinnar","Airavatesvara Temple, Darasuram","Kampaheswarar Temple, Tribhuvanam",b
The famous bronze statue of 'Nataraja' is considered an excellent example of which art form?,Pandya art,Chera art,Chola art,Pallava art,c
Who is credited with the construction of the artificial lake named Chola Gangam?,Rajaraja I,Karikala,Rajendra I,Parantaka I,c
The language most likely spoken in the Chera kingdom of Mahodayapuram was:,Telugu,Tamil,Malayalam,Kannada,c
The construction of the sixteen-mile-long 'Chola lake' for irrigation is attributed to:,Rajaraja I,Rajendra I,Parantaka I,Karikala,b
"According to Chola inscriptions, land donated to Jain assemblies was known as:",Brahmadeya,Vellanvagai,Shalabhoga,Pallichchhandam,d
"Land given for the maintenance of a Gurukul, as mentioned in Chola inscriptions, was called:",Vellanvagai,Brahmadeya,Shalabhoga,Devadana,c
What was the capital of the Pandya dynasty?,Kanchi,Thanjavur,Madurai,Mahabalipuram,c
Which dynasty ruled the area around Madurai and gained prominence in the thirteenth century?,Cholas,Pallavas,Pandyas,Chalukyas,c
Which Chalukya king is credited with defeating King Harsha of Kannauj?,Pulakeshin I,Kirtivarman I,Pulakeshin II,Vikramaditya I,c
The early Chera kings primarily ruled over which of the following states?,Andhra Pradesh and Karnataka,Tamil Nadu and Kerala,Karnataka and Kerala,Andhra Pradesh and Tamil Nadu,b
Which Tamil text is referred to as 'Laghuveda'?,Silappadikaram,Manimekalai,Kural,Tolkappiyam,c
Who authored the Silappadikaram?,Tiruvalluvar,Ilango,Sittalaicattanar,Bharathiyar,b
Where was the third Sangam held?,Kanchi,Uraiyur,Madurai,Thanjavur,c
In which state is the archaeological site Goddiproly located?,Tamil Nadu,Karnataka,Kerala,Andhra Pradesh,d
The famous bronze statue of 'Nataraja' is a prime example of which form of art?,Pallava art,Chola art,Vijayanagara art,Maurya art,b
Which dynasty had a practice of declaring its successor during its own reign?,Pallava,Chalukya,Chola,Pandya,c
The artificial lake named 'Chola Gangam' is attributed to which ruler?,Rajaraja I,Rajendra,Parantaka I,Karikala,b
The Brihadishvara Temple of Thanjavur was commissioned by:,Rajendra I,Rajaraja I,Kulottunga I,Parantaka I,b
The Chola kingdom primarily encompassed which geographical area?,"Malabar Coast, parts of the Deccan","Coromandel Coast, parts of the Deccan","Konkan Coast, parts of the Deccan","Gujarat Coast, parts of the Deccan",b
The sixteen-mile-long 'Chola lake' was constructed for the purpose of:,Navigation,Defense,Irrigation,Recreation,c
"In Chola inscriptions, the land allocated for Gurukul maintenance was referred to as:",Devadana,Brahmadeya,Pallichchhandam,Shalabhoga,d
Which dynasty is credited with establishing shipping enterprises in Southeast Asia?,Pallava,Chera,Chola,Pandya,c
Which Chalukya king defeated King Harsha of Kannauj?,Pulakeshin I,Kirtivarman I,Pulakeshin II,Vikramaditya I,c
The early Chera kings primarily ruled over which states?,Karnataka and Andhra Pradesh,Tamil Nadu and Kerala,Andhra Pradesh and Orissa,Kerala and Karnataka,b
The Sangam text Tolkappiyam is primarily based on:,Poetry,Drama,Grammar,Philosophy,c
Which Tamil text is also known as 'Laghuveda'?,Silappadikaram,Manimekalai,Kural,Tolkappiyam,c
Who authored the Tamil epic Silappadikaram?,Tiruvalluvar,Ilango,Sattanar,Bharatiyar,b
The third Sangam was held at which location?,Kanchi,Madurai,Uraiyur,Korkai,b
The famous bronze statue of 'Nataraja' is a prime example of:,Pallava art,Chola art,Vijayanagara art,Pandya art,b
Which South Indian dynasty had a practice of declaring its successor during its own reign?,Pallava,Chera,Chola,Pandya,c
Which South Indian state was well-known for its naval power?,Pallava,Chera,Chola,Pandya,c
The credit for constructing the artificial lake named Chola Gangam goes to:,Rajaraja I,Rajendra,Karikala,Parantaka I,b
The Brihadishvara Temple of Thanjavur was constructed by whom?,Rajendra I,Karikala,Rajaraja I,Parantaka I,c
The 'Totta Variyam' during the Chola reign was responsible for:,Maintaining law and order,Looking after the garden administration,Collecting taxes,Overseeing military affairs,b
Which Chola ruler conquered the northern part of Sri Lanka?,Kulottunga I,Rajendra Chola III,Rajaraja I,Rajaraja,c
Kulottunga I is known for which of the following?,Defeating the Rashtrakutas at Takkolam,Giving complete independence to Sri Lanka and marrying his daughter to a Sinhala prince,Building the Brihadishvara Temple,Conquering the islands of Maldives,b
During whose reign were 72 traders sent to China?,Rajaraja I,Rajendra Chola III,Rajaraja,Kulottunga-I,d
The 'Battle of Takkolam' was fought between which of the following?,The Cholas and the Pandyas,The Cholas and the Chalukyas,The Cholas and the Rashtrakutas,The Cholas and the Cheras,c
Who was the last ruler of the Chola dynasty?,Rajaraja I,Kulottunga I,Rajaraja,Rajendra Chola III,d
Which Chola king is credited with winning a naval victory over the islands of Maldives?,Rajendra Chola III,Kulottunga I,Rajaraja,Rajaraja I,c
"The Brihadishvara Temple, dedicated to Lord Shiva, is located in:",Madurai,Kanchipuram,Thanjavur,Vatapi,c
Rajaraja I held which of the following titles?,Gangaikonda Chola,Shivapada Shekhara,Vikramaditya,Parantaka,b
In which year did Rajaraja I ascend the Chola throne?,1014 AD,985 AD,1000 AD,950 AD,b
"In Chola administration, what was the assembly of villages mainly settled by Brahmins called?",Ur,Nadu,Sabha,Mahasabha,c
Sabha and Ur are mentioned as types of village assemblies in which dynasty?,Maurya,Gupta,Chalukya,Chola,d
What was the capital of the Chalukyas?,Kanchipuram,Thanjavur,Vatapi,Madurai,c
Who managed the bathrooms and kitchens of the Chalukya kings?,Only women,Only men,Only eunuchs,Both women and men,d
Which Chinese traveler provided an account of the relations between China and India during the Chalukya reign?,Fa Hien,I-Tsing,Xuanzang,Marco Polo,c
Which dynasty often gave women high positions in administration?,Maurya,Gupta,Chola,Chalukya,d
Kalidasa is mentioned in which inscription?,Allahabad Pillar Inscription,Mehrauli Iron Pillar Inscription,Aihole inscription of Pulakeshin II,Junagadh Rock Inscription,c
"According to a Chalukya inscription, the year of Shaka Samvat is 556. What is its equivalent year?",556 AD,500 AD,634 AD,700 AD,c
Pulakeshin I and Pulakeshin II were rulers related to which dynasty?,Maurya,Gupta,Chola,Chalukya,d
Pulakeshin II was the most famous ruler of the:,Maurya Dynasty,Gupta Dynasty,Chola Dynasty,Chalukya Dynasty,d
"During the Chola reign, which Variyam oversaw the garden administration?",Ur Variyam,Sabha Variyam,Totta Variyam,Gram Variyam,c
Which Chola ruler is credited with conquering the northern part of Sri Lanka?,Kulottunga I,Rajendra Chola III,Rajaraja I,Rajendra I,c
Which Chola king granted complete independence to Sri Lanka and facilitated a marriage alliance with a Sinhala prince?,Rajaraja I,Rajendra Chola III,Rajendra I,Kulottunga I,d
Which Chola king achieved a naval victory over the islands of Maldives?,Rajaraja,Rajendra Chola III,Kulottunga I,Rajendra I,a
"In which city is the Brihadishvara Temple, dedicated to Lord Shiva, located?",Kanchipuram,Madurai,Thanjavur,Vatapi,c
The Brihadishvara Temple was dedicated in which year?,1004,1024,1014,1034,c
Which Chola ruler held the title 'Shivapada Shekhara'?,Rajendra Chola III,Kulottunga I,Rajendra I,Rajaraja-I,d
Which of the following best describes 'Sabha' in Chola administration?,Assembly of merchants,Assembly of artisans,Assembly of warriors,Assembly of villages settled by Brahmins,d
The capital of the Chalukyas was:,Thanjavur,Madurai,Vatapi,Kanchipuram,c
Which dynasty frequently granted high administrative positions to women?,Chola,Rashtrakuta,Chalukya,Maurya,c
Where is the Sanskrit poet and playwright Kalidasa mentioned?,Junagadh inscription of Rudradaman,Allahabad Pillar inscription,Aihole inscription of Pulakeshin II,Mehrauli Iron Pillar inscription,c
"According to a Chalukya inscription, the Shaka Samvat year 556 corresponds to which year AD?",534 AD,654 AD,634 AD,582 AD,c
Pulakeshin I and Pulakeshin II were rulers belonging to which dynasty?,Chola dynasty,Maurya dynasty,Chalukya dynasty,Gupta dynasty,c
The most famous ruler Pulakeshin II belonged to which dynasty?,Maurya,Chola,Chalukya,Gupta,c
"During the Chola reign, which Variyam managed the garden administration?",Ur Variyam,Sabha Variyam,Totta Variyam,Grama Variyam,c
Which Chola king granted complete independence to Sri Lanka and arranged his daughter's marriage to a Sinhala prince?,Rajaraja I,Rajendra Chola III,Rajendra I,Kulottunga I,d
The Battle of Takkolam involved which of the following dynasties?,The Cholas and the Pallavas,The Cholas and the Rashtrakutas,The Chalukyas and the Rashtrakutas,The Pallavas and the Chalukyas,b
In which city is the Brihadishvara Temple located?,Kanchi,Madurai,Thanjavur,Vatapi,c
"The Brihadishvara Temple, dedicated to Lord Shiva, was completed in which year?",1004,1024,1014,985,c
"In the Chola administration, what was the assembly of villages mainly settled by Brahmins called?",Ur,Nadu,Sabha,Grama,c
Which of the following dynasties is associated with the village assemblies known as Sabha and Ur?,Pallava,Chalukya,Rashtrakuta,Chola,d
Which dynasty often granted high positions in administration to women?,Chola,Pallava,Chalukya,Gupta,c
In which inscription is the Sanskrit poet and playwright Kalidasa mentioned?,Junagadh inscription of Rudradaman,Allahabad Pillar Inscription,Aihole inscription of Pulakeshin II,Hathigumpha Inscription,c
"According to a Chalukya inscription, if the Shaka Samvat year is 556, what is its equivalent year AD?",556 AD,500 AD,634 AD,656 AD,c
Pulakeshin I and Pulakeshin II were rulers of which dynasty?,Chola dynasty,Maurya dynasty,Chalukya dynasty,Gupta dynasty,c
Pulakeshin II was the most famous ruler of which dynasty?,Chola,Pallava,Chalukya,Rashtrakuta,c
The garden administration during the Chola reign was overseen by which Variyam?,Ur Variyam,Sabha Variyam,Totta Variyam,Gram Variyam,c
During whose reign were 72 traders dispatched to China?,Rajaraja I,Rajendra Chola III,Kulottunga-I,Rajendra I,c
Which Chola king achieved a naval victory over the Maldives?,Rajaraja,Rajendra Chola III,Kulottunga I,Rajendra I,a
In which location is the Brihadishvara Temple situated?,Madurai,Kanchipuram,Thanjavur,Vatapi,c
In what year did Rajaraja I ascend the Chola throne?,1014 AD,958 AD,985 AD,1000 AD,c
What was the name of the Brahmin-settled village assembly in Chola administration?,Ur,Nadu,Mangalam,Sabha,d
Which dynasty is associated with the Sabha and Ur village assemblies?,Pallava,Chalukya,Rashtrakuta,Chola,d
Which Chinese traveler provided an account of China-India relations during the Chalukya reign?,Fa Hien,I-Tsing,Xuanzang,Hui-li,c
Which dynasty is known for frequently granting women high administrative positions?,Chola,Pallava,Chalukya,Rashtrakuta,c
In which inscription is the Sanskrit poet Kalidasa mentioned?,Junagadh inscription,Prayag Prasasti,Aihole inscription of Pulakeshin II,Mehrauli Iron Pillar inscription,c
"According to a Chalukya inscription, the Shaka Samvat year 556 corresponds to which year?",556 AD,600 AD,634 AD,700 AD,c
Pulakeshin I and Pulakeshin II were associated with which dynasty?,Chola dynasty,Pallava dynasty,Chalukya dynasty,Maurya dynasty,c
Which dynasty did Pulakeshin II belong to?,Rashtrakuta,Chola,Chalukya,Pallava,c
Who was the author of 'Mattavilasa Prahasana'?,Narasimhavarman II,Simha Vishnu,Mahendravarman,Dandin,c
Which dynasty was King Simha Vishnu the ruler of?,Chalukya,Rashtrakuta,Pallava,Chola,c
The Brihadishvara Temple of Thanjavur was constructed during whose reign?,Mahendravarman,Dantidurga,Rajaraja,Simha Vishnu,c
The capital of the Hoysala Empire was:,Madurai,Kanchipuram,Dwarasamudra,Warangal,c
"Dantidurga, a Rashtrakuta chief, overthrew his Chalukya overlord in which century?",Sixth,Ninth,Seventh,Eighth,d
What was Warangal famous for in the third century?,Silk production,Naval power,Iron tools/equipment,Spice trade,c
Which Chola king adopted the title of 'Shivapada Shekhara'?,Mahendravarman,Rajaraja-I,Simha Vishnu,Dantidurga,b
In which year did the Chola king Rajaraja I ascend the throne?,1000 AD,950 AD,985 AD,1025 AD,c
The capital of Aihole belonged to which dynasty?,The Rashtrakutas,The Pallavas,The Chalukyas,The Cholas,c
Who is credited as the author of 'Mattavilasa Prahasana'?,Narasimhavarman II,Simha Vishnu,Dantidurga,Mahendravarman,d
Which Pallava king held the title 'Rajasimha'?,Simha Vishnu,Mahendravarman,Narasimhavarman II,Rajaraja I,c
King Simha Vishnu was a ruler of which dynasty?,Rashtrakuta,Chalukya,Chola,Pallava,d
"In the seventh and eighth centuries, which dynasty became powerful with Kanchipuram as their capital?",The Cholas,The Rashtrakutas,The Chalukyas,The Pallavas,d
Which Pallava king is known for writing Sanskrit plays?,Narasimhavarman II,Simha Vishnu,Mahendravarman,Dantidurga,c
During whose reign was the Brihadishvara Temple of Thanjavur constructed?,Mahendravarman,Dantidurga,Rajaraja,Simha Vishnu,c
What was the capital of the Hoysala Empire?,Kanchipuram,Madurai,Warangal,Dwarasamudra,d
"Initially, the Rashtrakutas served as subordinates to which dynasty of Karnataka?",The Cholas,The Pallavas,The Chalukyas,The Pandyas,c
"Dantidurga, a Rashtrakuta chief, performed a ritual called what after overthrowing his Chalukya overlord?",Rajabhiseka,Mattavilasa,Shivapada,Hiranya Garbha,d
Which city served as the capital for the Pandya kings?,Dwarasamudra,Kanchipuram,Madurai,Warangal,c
Who decorated the assembly of the Pallavas as a famous Sanskrit writer?,Rajaraja I,Dantidurga,Dandin,Mahendravarman,c
For what was Warangal famous in the third century?,Silk production,Naval power,Iron tools/equipment,Spice trade,c
Which Chola ruler adopted the title 'Shivapada Shekhara'?,Mahendravarman,Dantidurga,Simha Vishnu,Rajaraja-I,d
In what year did the Chola king Rajaraja I ascend to the throne?,885 AD,1000 AD,985 AD,1085 AD,c
"In Chola administration, what was the name for the assembly of villages mainly settled by Brahmins?",Ur,Nadu,Sabha,Mahasabha,c
"In which dynasty are the village assemblies, Sabha and Ur, mentioned?",Pallava,Rashtrakuta,Chalukya,Chola,d
The author of 'Mattavilasa Prahasana' was:,Narasimhavarman II,Simha Vishnu,Mahendravarman,Dandin,c
The Pallava king whose title was 'Rajasimha' was:,Simha Vishnu,Mahendravarman,Dantidurga,Narasimhavarman II,d
King Simha Vishnu was the ruler of which dynasty?,Chalukya,Rashtrakuta,Pallava,Chola,c
Which city served as the capital for the Pallavas during the seventh and eighth centuries?,Madurai,Warangal,Dwarasamudra,Kanchipuram,d
The Brihadishvara Temple of Thanjavur was built during whose reign?,Mahendravarman,Dantidurga,Rajaraja,Simha Vishnu,c
Who were initially subordinates of the Chalukyas of Karnataka?,The Pallavas,The Cholas,The Rashtrakutas,The Pandyas,c
Which ritual was performed by Dantidurga after overthrowing his Chalukya overlord?,Shivapada Shekhara,Rajasimha,Mattavilasa Prahasana,Hiranya Garbha,d
"In the third century, for what was Warangal famous?",Sanskrit Plays,Silk Weaving,Iron tools/equipment,Temple Architecture,c
Which Chola ruler adopted the title of 'Shivapada Shekhara'?,Mahendravarman,Dantidurga,Rajaraja-I,Simha Vishnu,c
In what year did the Chola king Rajaraja I ascend the throne?,885 AD,1085 AD,785 AD,985 AD,d
"In Chola administration, the assembly of villages mainly settled by Brahmins was known as:",Ur,Nagram,Sabha,Mahasabha,c
"Sabha and Ur, two types of village assemblies, are mentioned in which dynasty's administration?",Pallava,Chalukya,Rashtrakuta,Chola,d
Simha Vishnu was the ruler of which dynasty?,Chalukya,Rashtrakuta,Pallava,Chola,c
"Initially, who were subordinates of the Chalukyas of Karnataka?",Pallavas,Cholas,Rashtrakutas,Pandyas,c
Which city served as the capital of the Pandya kings?,Kanchipuram,Thanjavur,Madurai,Dwarasamudra,c
Who decorated the assembly of the Pallavas with his writings?,Rajaraja-I,Dantidurga,Mahendravarman,Dandin,d
"In the third century, Warangal was renowned for what?",Sanskrit plays,Silk weaving,Iron tools/equipment,Naval power,c
