Question,Option A,Option B,Option C,Option D,Correct Answer
The Jagannath Temple of Puri was built by whom?,Rajaraja Chola,Anantavarman Chodaganga,Narasimhadeva I,Yayati Keshari,b
The Somnath Temple is located in which state?,Maharashtra,Rajasthan,Gujarat,Madhya Pradesh,c
In which state is the Sabarimala Temple located?,Tamil Nadu,Karnataka,Kerala,Andhra Pradesh,c
The temple located in the Elephanta Caves near Mumbai is dedicated to which deity?,Lord Vishnu,Lord Brahma,Lord Shiva,Goddess Lakshmi,c
"Match the following temples with their locations:

Column I
(A) Dilwara Temple
(B) Konark Sun Temple
(C) Brihadishvara Temple
(D) Somnath Temple

Column II
(1) Tamil Nadu
(2) Gujarat
(3) Mount Abu
(4) Odisha","A-3, B-4, C-1, D-2","A-4, B-3, C-2, D-1","A-1, B-2, C-3, D-4","A-2, B-1, C-4, D-3",a
"The Kailasa Temple of Ellora, known as one of the largest rock-cut temples, is located in which state?",Karnataka,Tamil Nadu,Maharashtra,Andhra Pradesh,c
"In India, Neolithic cave paintings are found in which of the following locations?",Ajanta,Ellora,Bhimbetka,Udayagiri,c
"The Panchmukhi caves, famous for prehistoric paintings, are located in which district?",Aurangabad,Madurai,Sonbhadra,Kanchi,c
The Udayagiri and Khandagiri caves are located in which state?,Maharashtra,Odisha,Tamil Nadu,Andhra Pradesh,b
"Which city is the location of the Ajanta caves, a World Heritage Site?",Mumbai,Pune,Aurangabad,Nagpur,c
The temples of Ellora were built by which dynasty?,The Pallavas,The Cholas,The Rashtrakutas,The Hoysalas,c
"Approximately how old are the Ajanta caves, which consist of about 30 rock-cut Buddhist caves?",2nd century CE,5th century CE,2nd century BCE,5th century BCE,c
The Chennakesava temple was built during the reign of which empire?,The Pallavas,The Rashtrakutas,The Hoysala empire,The Cholas,c
"The group of monuments in Mahabalipuram, Tamil Nadu, was built by which dynasty?",The Cholas,The Pallavas,The Rashtrakutas,The Guptas,b
In which of the following locations is the Shore Temple situated?,Kanchipuram,Madurai,Mahabalipuram,Bhubaneswar,c
The Kailasanatham temple in Kanchipuram was constructed during the reign of which dynasty?,The Cholas,The Hoysalas,The Pallavas,The Rashtrakutas,c
The Meenakshi Temple is situated in which city?,Kanchi,Mahabalipuram,Madurai,Bhubaneswar,c
Who built the Saptaratha temple of Mahabalipuram?,Rudra Deva,King Narasimha Deva I,Narasimha Varman,None of the above,c
The Rath temples in Mahabalipuram were constructed by which dynasty?,The Cholas,The Rashtrakutas,The Pallavas,The Guptas,c
The Thousand Pillar Temple was built by whom?,King Narasimha Deva I,Narasimha Varman,Rudra Deva,None of the above,c
The temples of Bhubaneswar and Puri are constructed in which style?,Dravidian style,Vesara style,Nagara style,Gandhara style,c
The Vishnu temple of Angkor Wat is situated in which country?,India,Thailand,Cambodia,Indonesia,c
The temple of Lord Ranganatha in South India is located on which hill?,Nilgiri Hill,Tirumala Hill,Anaimalai Hill,Palani Hill,b
"The Chitragupta Swami Temple, considered the only temple of Chitragupta, is located in which city?",Madurai,Kanchi,Mahabalipuram,Bhubaneswar,b
Who built the Konark temple in Orissa?,Rudra Deva,Narasimha Varman,King Narasimha Deva I,None of the above,c
"In temples of the Dravidian style, what does 'Gopuram' refer to?",The main deity,A sacred pond,An ornate and multi-storied building above the gateway,The inner sanctum,c
Identify the INCORRECT statement:,The Ajanta caves are located in Maharashtra.,The Kailasa Temple of Ellora is a rock-cut temple.,The temples of Bhubaneswar are built in the Dravidian style.,The Shore Temple is located in Mahabalipuram.,c
During which period was the construction of Ajanta caves?,Mauryan period,Gupta period,Vardhana period,Sunga period,b
"The Kailasa Temple of Ellora, a large rock-cut temple, is located in which state?",Karnataka,Andhra Pradesh,Tamil Nadu,Maharashtra,d
"In India, where are Neolithic cave paintings found?",Ajanta,Ellora,Bhimbetka,Mahabalipuram,c
In which state are the Udayagiri and Khandagiri caves located?,Karnataka,Odisha,Andhra Pradesh,Tamil Nadu,b
"The Ajanta caves, a World Heritage Site, are located in which district?",Madurai,Kanchi,Aurangabad,Sonbhadra,c
Which dynasty built the temples of Ellora?,The Pallavas,The Cholas,The Rashtrakutas,The Mauryas,c
Approximately how old are the Ajanta caves?,5th century CE,2nd century BCE,10th century CE,1st century CE,b
The Kailasanatham temple in Kanchipuram was built during the reign of which dynasty?,The Cholas,The Hoysalas,The Pallavas,The Pandyas,c
Which of the following statements is INCORRECT regarding the temples mentioned?,The Meenakshi Temple is located in Madurai.,The Shore Temple is located in Mahabalipuram.,The Thousand Pillar Temple was built by Rudra Deva.,The Konark temple in Orissa was built by The Pallavas.,d
The Saptaratha temple of Mahabalipuram was built by whom?,Rudra Deva,Narasimha Varman,King Narasimha Deva I,None of the above,b
In which style are the temples of Bhubaneswar and Puri built?,Dravidian style,Nagara style,Vesara style,Hoysala style,b
The Vishnu temple of Angkor Wat is located in which country?,India,Thailand,Cambodia,Indonesia,c
"Where is the Chitragupta Swami Temple, considered the only temple of Chitragupta, located?",Madurai,Kanchi,Mahabalipuram,Bhubaneswar,b
Neolithic cave paintings in India are predominantly found in which of the following locations?,Ajanta,Ellora,Bhimbetka,Udayagiri,c
"The Panchmukhi caves, renowned for their prehistoric paintings, are situated in which district?",Aurangabad,Sonbhadra,Madurai,Kanchi,b
In which state are the Udayagiri and Khandagiri rock-cut caves located?,Andhra Pradesh,Odisha,Karnataka,Tamil Nadu,b
"The Ajanta caves, recognized as a World Heritage Site, are located in which district?",Mumbai,Pune,Aurangabad,Nagpur,c
The temples of Ellora were constructed by which dynasty?,The Mauryas,The Guptas,The Rashtrakutas,The Pallavas,c
The Ajanta caves are approximately how old?,5th century CE,2nd century BCE,10th century CE,1st century CE,b
The Chennakesava temple was built during which empire?,Chola Empire,Hoysala Empire,Vijayanagara Empire,Chalukya Empire,b
The Shore Temple is situated in which of the following locations?,Kanchipuram,Madurai,Mahabalipuram,Bhubaneswar,c
The Meenakshi Temple is located in which city?,Kanchi,Mahabalipuram,Madurai,Aurangabad,c
The Rath temples in Mahabalipuram were built by which dynasty?,The Cholas,The Hoysalas,The Pallavas,The Pandyas,c
The Konark temple in Orissa was built by whom?,Narasimha Varman,Rudra Deva,King Narasimha Deva I,Vishnuvardhana,c
"The Kailasa Temple of Ellora, known as one of the largest rock-cut temples, is located in which Indian state?",Karnataka,Tamil Nadu,Maharashtra,Andhra Pradesh,c
"In which district are the famous Panchmukhi caves, known for their prehistoric paintings, situated?",Mirzapur,Sonbhadra,Chandauli,Varanasi,b
"The Udayagiri and Khandagiri caves, recognized as rock-cut caves, are located in which state?",West Bengal,Bihar,Odisha,Jharkhand,c
"The Ajanta caves, recognized as a World Heritage Site, are located in which city?",Mumbai,Pune,Aurangabad,Nagpur,c
"Approximately how old are the Ajanta caves, known as rock-cut Buddhist caves?",5th century CE,2nd century BCE,8th century CE,1st century CE,b
During which empire was the Chennakesava temple constructed?,Vijayanagara Empire,Hoysala Empire,Chalukya Dynasty,Kakatiya Dynasty,b
The Saptaratha temple of Mahabalipuram was constructed by whom?,Mahendravarman I,Raja Raja Chola I,Narasimha Varman,Pulakeshin II,c
In which country is the Vishnu temple of Angkor Wat located?,Thailand,Vietnam,Cambodia,Laos,c
Who constructed the Konark temple in Orissa?,Raja Raja Chola I,King Narasimha Deva I,Harshavardhana,Chandragupta Maurya,b
"Match the following:

Column I
(A) Ajanta Caves
(B) Shore Temple
(C) Meenakshi Temple
(D) Konark Temple

Column II
(1) Mahabalipuram
(2) Madurai
(3) Aurangabad
(4) Orissa

","A-3, B-1, C-2, D-4","A-1, B-2, C-3, D-4","A-4, B-3, C-2, D-1","A-2, B-4, C-1, D-3",a
In which state is Shravanabelagola situated?,Andhra Pradesh,Tamil Nadu,Karnataka,Kerala,c
The Khajuraho temples were constructed by which dynasty?,The Mauryas,The Cholas,The Chandellas,The Guptas,c
The 'Konark' temple is associated with which deity?,Shiva,Vishnu,Sun,Indra,c
Which of the following temples showcases a Shikhara built in the Dravidian style?,Khajuraho Temple,Teli ka Mandir of Gwalior,Lingaraj Temple,Konark Temple,b
What is the architectural style of the Brihadishvara Temple located in Tamil Nadu?,Nagara,Vesara,Dravidian,Indo-Islamic,c
"In the context of South Indian temples, what are the high gates built in the courtyards called?",Mandapa,Garbhagriha,Gopuram,Vimana,c
From what material was the Hoysaleswara Temple primarily constructed?,Red sandstone,White marble,Black schist stone,Granite,c
The ancient temple dedicated to Bhima Devi is located in which of the following?,Khajuraho,Puri,"Pinjore, Haryana",Ellora,c
In which district is the Lingaraj Temple located?,Cuttack,Puri,Bhubaneswar,Sambalpur,c
The Grishneshwar Jyotirlinga is located in which state?,Gujarat,Rajasthan,Madhya Pradesh,Maharashtra,d
In which state is Rajrappa located?,Bihar,West Bengal,Odisha,Jharkhand,d
Who excavated the Khandagiri caves?,Ashoka,Kanishka,Kharavela,Harshavardhana,c
"Bhimbetka, a global heritage site in Madhya Pradesh, is renowned for its:",Stupas,Rock shelters,Cave paintings of Ajanta,Pillar inscriptions,b
Approximately how old are the Bhimbetka caves estimated to be?,"5,000 years old","10,000 years old","30,000 years old","50,000 years old",c
Which religious groups are represented in the caves and rock-cut temples of Ellora?,Hindus and Buddhists,Buddhists and Jains,Hindus and Jains,"Hindus, Buddhists and Jains",d
In which state are the Ajanta and Ellora caves located?,Gujarat,Karnataka,Maharashtra,Madhya Pradesh,c
Where is the largest and most developed rock-cut Chaitya-griha of the Hinayana phase located?,Ajanta,Ellora,Karle,Kanheri,c
Which site is known for having more than a hundred Buddhist caves?,Ajanta,Ellora,Karle,Kanheri,d
Which cave features the depiction of Bodhisattva with eleven heads?,Ajanta,Ellora,Kanheri,Elephanta,c
Which cave is renowned for the 'Trimurti' sculpture?,Ajanta,Ellora,Kanheri,Elephanta,d
The rock-cut temples of Elephanta are credited to which dynasty?,The Cholas,The Pallavas,The Mauryas,The Guptas,b
Which structure is considered a wonder of rock-cut architecture?,Ajanta Caves,Elephanta Caves,"Kailasa Temple, Ellora",Karle Caves,c
"Match the following:
Column I
(A) Govind Mahal
(B) Konark Temple
(C) Hoysaleswara Temple
(D) Grishneshwar Jyotirlinga

Column II
(1) Sun
(2) Datia
(3) Maharashtra
(4) Black schist stone

Choose the correct sequence:","A-2, B-1, C-4, D-3","A-1, B-2, C-3, D-4","A-4, B-3, C-2, D-1","A-3, B-4, C-1, D-2",a
"The Govind Mahal, renowned for Hindu architecture, is located in which of the following?",Khajuraho,Datia,Gwalior,Bhubaneswar,b
Who were the builders of the Khajuraho temples?,The Mauryas,The Guptas,The Chandellas,The Pallavas,c
The 'Konark' temple is dedicated to which deity?,Shiva,Vishnu,Sun,Indra,c
Which of the following temples features a Shikhara built in the Dravidian style?,Khajuraho Temple,Teli ka Mandir of Gwalior,Lingaraj Temple,Hoysaleswara Temple,b
The Brihadishvara Temple in Tamil Nadu is built in which architectural style?,Nagara,Vesara,Dravidian,Indo-Islamic,c
How many temples are there in the Panchayatan style of architecture?,3,4,5,6,c
In which state is the Shri Brahmapurishwara Temple located?,Karnataka,Andhra Pradesh,Kerala,Tamil Nadu,d
What were the high gates built in the courtyards of temples in South India called?,Mandapa,Gopuram,Shikhara,Vimana,b
From what material was the Hoysaleswara Temple built?,Red sandstone,White marble,Black schist stone,Granite,c
Where is the Govardhan Math located?,Varanasi,Puri,Dwarka,Badrinath,b
The Lingaraj Temple is located in which district?,Cuttack,Puri,Bhubaneswar,Sambalpur,c
In which state is the Grishneshwar Jyotirlinga located?,Gujarat,Madhya Pradesh,Maharashtra,Rajasthan,c
Rajrappa is located in which state?,Bihar,Chhattisgarh,Jharkhand,Odisha,c
"Bhimbetka, a global heritage site, is famous for what?",Temple architecture,Rock shelters,Sculptures,Paintings,b
Approximately how old are the Bhimbetka caves considered to be?,"10,000 years old","20,000 years old","30,000 years old","40,000 years old",c
The caves and rock-cut temples in Ellora belong to which religions?,Hindus and Buddhists,Buddhists and Jains,Hindus and Jains,"Hindus, Buddhists and Jains",d
Which center contains more than a hundred Buddhist caves?,Ajanta,Ellora,Karle,Kanheri,d
In which rock-cut cave is the depiction of Bodhisattva with eleven heads found?,Ajanta,Ellora,Karle,Kanheri,d
Which cave is famous for the 'Trimurti' sculpture?,Ajanta,Ellora,Elephanta,Karle,c
The credit for the famous rock-cut temples of Elephanta is given to which dynasty?,The Mauryas,The Guptas,The Pallavas,The Cholas,c
Which is considered the wonder of rock-cut architecture?,Ajanta Caves,Elephanta Caves,"Kailasa Temple, Ellora",Karle Caves,c
"The Govind Mahal, noted for its Hindu architecture, is located in:",Khajuraho,Gwalior,Datia,Bhubaneswar,c
The Brihadishvara Temple in Tamil Nadu exhibits which architectural style?,Nagara,Vesara,Dravidian,Gandhara,c
How many temples are present in the Panchayatan style of architecture?,3,4,5,6,c
The Shri Brahmapurishwara Temple is situated in which state?,Karnataka,Andhra Pradesh,Tamil Nadu,Kerala,c
The Hoysaleswara Temple was constructed using which material?,Red sandstone,White marble,Black schist stone,Granite,c
Rajrappa is situated in which of the following states?,Bihar,Chhattisgarh,Jharkhand,Odisha,c
Which king is credited with the excavation of the Khandagiri caves?,Ashoka,Kanishka,Kharavela,Harshavardhana,c
Which center is known for having more than a hundred Buddhist caves?,Ajanta,Ellora,Karle,Kanheri,d
The Elephanta cave is particularly famous for which sculpture?,Buddha,Trimurti,Mahavira,Nataraja,b
The famous rock-cut temples of Elephanta are attributed to which dynasty?,The Mauryas,The Guptas,The Pallavas,The Cholas,c
Which of the following is considered a wonder of rock-cut architecture?,Ajanta Caves,Elephanta Caves,"Kailasa Temple, Ellora",Karle Caves,c
"Match the following temples with their locations:

Column I
(A) Lingaraj Temple
(B) Govardhan Math
(C) Bhima Devi Temple

Column II
(1) Puri
(2) Pinjore
(3) Bhubaneswar

Choose the correct sequence:","A-1, B-2, C-3","A-3, B-1, C-2","A-2, B-3, C-1","A-3, B-2, C-1",b
"The Govind Mahal, known for its Hindu architecture, is located in which city?",Khajuraho,Gwalior,Datia,Bhubaneswar,c
To which deity is the 'Konark' temple dedicated?,Shiva,Vishnu,Sun,Indra,c
Which temple features a Shikhara built in the Dravidian style?,Lingaraj Temple,Hoysaleswara Temple,Teli ka Mandir of Gwalior,Brihadishvara Temple,c
What is the architectural style of the Brihadishvara Temple in Tamil Nadu?,Nagara,Vesara,Dravidian,Panchayatan,c
"In the Panchayatan style of architecture, how many temples are typically present?",3,4,5,7,c
The Bhima Devi temple is located in which state?,Punjab,Haryana,Rajasthan,Gujarat,b
In which district is the famous Lingaraj Temple situated?,Cuttack,Bhubaneswar,Puri,Sambalpur,b
The Khandagiri caves were excavated by which king?,Ashoka,Kanishka,Kharavela,Harshavardhana,c
"Bhimbetka, a global heritage site, is known for what?",Cave paintings,Rock shelters,Ancient sculptures,Buddhist stupas,b
What is the estimated age of the Bhimbetka caves?,"10,000 years old","20,000 years old","30,000 years old","40,000 years old",c
The caves and rock-cut temples in Ellora represent which religions?,Hindus and Buddhists,Buddhists and Jains,Hindus and Jains,"Hindus, Buddhists and Jains",d
The temple of Mahabalipuram was built by cutting rocks by which dynasty?,The Rashtrakutas,The Chalukyas,The Pallavas,The Kushanas,c
"In which state is the Ravan Phadi cave, an example of early Chalukya architecture, located?",Madhya Pradesh,Andhra Pradesh,Maharashtra,Karnataka,d
"The Bagh Caves, containing 9 Buddhist caves, are located in which Indian state?",Andhra Pradesh,Karnataka,Madhya Pradesh,Maharashtra,c
The 7-meter high idol 'Sadashiva' representing the three faces of Lord Shiva is found in which cave?,Bagh Caves,Ellora Caves,Borra Caves,Elephanta Cave,d
"Borra Caves, a limestone cave in India, are located in which state?",Karnataka,Andhra Pradesh,Madhya Pradesh,Maharashtra,b
In which of the following places is the popular rock-cut sculpture 'Gangavataran' found?,Ellora,Ajanta,Mahabalipuram,Elephanta,c
During which period did Gandhara art flourish extensively?,First century BC and 4th century BC,Second century AD and 5th century AD,Third century BC and 6th century AD,Fourth century AD and 7th century BC,a
Which metal is the Ashoka Pillar in Delhi made of?,Copper,Bronze,Iron,Steel,c
The Varaha avatar of Vishnu is depicted in the sculpture at which of the following locations?,Elephanta cave,Ajanta cave,"Udayagiri cave, Vidisha",Ellora cave,c
Who built the Somapura Mahavihara?,Ashoka,Kanishka,Dharmapala,Harshavardhana,c
Gandhara art style is a synthesis of which two art forms?,Indian and Persian art,Indian and Roman art,Indian and Greek art,Persian and Greek art,c
Which one of the four toranas of the Great Stupa of Sanchi was built first?,Eastern,Northern,Western,Southern,d
"Match the following caves with their locations:

Column I
(A) Ellora Caves
(B) Bagh Caves

Column II
(1) Madhya Pradesh
(2) Maharashtra

Choose the correct option:","A-1, B-2","A-2, B-1","A-1, B-1","A-2, B-2",b
Which of the following statements is INCORRECT regarding the Ellora caves?,"They have Buddhist, Hindu and Jain monasteries and temples.",Cave temples were built by the Rashtrakutas.,They are located in Aurangabad (Maharashtra).,They only contain Hindu sculptures.,d
"The temple of Mahabalipuram was constructed by which dynasty, known for their rock-cutting architectural skills?",The Cholas,The Mauryas,The Pallavas,The Guptas,c
"In which state of India are the cave temples built by the Rashtrakutas, specifically those in the Ellora hills, situated?",Karnataka,Andhra Pradesh,Madhya Pradesh,Maharashtra,d
"Which of the following sites features a unique confluence of Buddhist, Hindu, and Jain rock-cut caves?",Ajanta,Elephanta,Ellora,Bagh,c
"The Ravan Phadi cave, showcasing early Chalukya architectural style, is located in which state?",Andhra Pradesh,Karnataka,Tamil Nadu,Maharashtra,b
"The Bagh Caves, comprising nine Buddhist caves, were developed in which century?",4th century,5th century,6th century,7th century,c
"The 'Sadashiva' idol, featuring the three faces of Lord Shiva, is prominently found in which cave?",Ajanta cave,Ellora cave,Elephanta cave,Bagh cave,c
To which deity are the Elephanta Caves primarily dedicated?,Lord Vishnu,Lord Brahma,Lord Shiva,Lord Buddha,c
"In which state are the Bagh Caves, renowned for their Indian rock-cut architecture, located?",Andhra Pradesh,Maharashtra,Madhya Pradesh,Karnataka,c
"Borra Caves, known as a limestone cave in India, are situated in which state?",Tamil Nadu,Kerala,Karnataka,Andhra Pradesh,d
The 'Gangavataran' sculpture is found at which location in India?,Ellora,Ajanta,Mahabalipuram,Elephanta,c
The 'Tantric Yogini' sect is believed to have originated in which state?,Madhya Pradesh,Odisha,Rajasthan,Gujarat,b
The Ashoka Pillar in Delhi is made of which metal?,Copper,Bronze,Iron,Steel,c
The Varaha avatar of Vishnu is depicted in which of the following caves?,Elephanta cave,Ajanta cave,"Udayagiri cave, Vidisha",Ellora cave,c
Who among the following built the Somapura Mahavihara?,Devapala,Ramapala,Dharmapala,Mahipala,c
Gandhara art style represents a fusion of which two artistic traditions?,Indian and Persian art,Indian and Roman art,Indian and Greek art,Indian and Chinese art,c
Which among the four toranas of the Great Stupa of Sanchi was constructed first?,Eastern one,Western one,Northern one,Southern one,d
"Match the following caves with their respective states:

Column I
(A) Bagh Caves
(B) Borra Caves

Column II
(1) Andhra Pradesh
(2) Madhya Pradesh

Choose the correct option:","A-1, B-2","A-2, B-1","A-1, B-1","A-2, B-2",b
The temple of Mahabalipuram was constructed by which dynasty?,The Cholas,The Rashtrakutas,The Pallavas,The Mauryas,c
"In which state is the Ravan Phadi cave, representative of early Chalukya architecture, located?",Maharashtra,Andhra Pradesh,Karnataka,Madhya Pradesh,c
"The Bagh Caves, known for their nine Buddhist caves, are situated in which of the following states?",Andhra Pradesh,Maharashtra,Karnataka,Madhya Pradesh,d
The 'Sadashiva' idol representing the three faces of Lord Shiva is located in which cave?,Ajanta Cave,Ellora Cave,Elephanta Cave,Bagh Cave,c
"The Borra Caves, known for their limestone formations, are located in which Indian state?",Karnataka,Andhra Pradesh,Maharashtra,Madhya Pradesh,b
The rock-cut sculpture 'Gangavataran' is found in which location in India?,Ellora,Ajanta,Mahabalipuram,Elephanta,c
During which dynasty did Gandhara art flourish extensively?,Maurya,Gupta,Kushana,Pallava,c
The 'Tantric Yogini' sect is believed to have originated in which of the following states?,Madhya Pradesh,Odisha,Karnataka,Andhra Pradesh,b
The Varaha avatar of Vishnu is depicted in the sculpture found at which location?,"Elephanta Cave, Maharashtra","Ajanta Cave, Maharashtra","Udayagiri Cave, Vidisha","Ellora Cave, Maharashtra",c
Which torana of the Great Stupa of Sanchi was constructed first?,Eastern,Western,Northern,Southern,d
Which of the following statements about Ellora caves is INCORRECT?,"They contain Buddhist, Hindu, and Jain monasteries and temples.",The Rashtrakutas built cave temples there.,"They are located in Aurangabad, Maharashtra.",They primarily feature Chalukya style architecture.,d
"In which state is the Ravan Phadi cave, known for its early Chalukya architecture, located?",Madhya Pradesh,Maharashtra,Andhra Pradesh,Karnataka,d
"The Bagh Caves, containing 9 Buddhist caves, are located in which of the following states?",Andhra Pradesh,Karnataka,Madhya Pradesh,Maharashtra,c
"The Borra Caves, a limestone cave, are located in which Indian state?",Karnataka,Madhya Pradesh,Andhra Pradesh,Maharashtra,c
The 'Gangavataran' rock-cut sculpture is found at which location in India?,Ellora,Ajanta,Mahabalipuram,Elephanta,c
Gandhara art flourished extensively during which empire?,Maurya,Gupta,Kushana,Pallava,c
The Varaha avatar of Vishnu is depicted in which cave?,Elephanta cave,Ajanta cave,"Udayagiri cave, Vidisha",Ellora cave,c
"In Ellora, which religious caves exist together?",Hindu and Jain,Buddhist and Hindu,Buddhist and Jain,"Buddhist, Hindu, and Jain",d
The Bagh Caves were developed in which century?,4th century,5th century,6th century,7th century,c
The iron pillar inscription of Mehrauli mentions which king?,Ashoka,Kanishka,Harshavardhana,Chandra,d
Which of the following statements is INCORRECT about the Great Stupa of Sanchi?,It has four toranas.,The Southern torana was built first.,It showcases only Hindu sculptures.,It is an example of ancient Indian architecture.,c
In which Indian state is the Sanchi Stupa situated?,Uttar Pradesh,Madhya Pradesh,Bihar,Haryana,b
Which of the following is related to the architecture of the Buddhist stupa?,Mandapa,Garbhagriha,Harmika,Pradakshina,c
"The Maurya pillar capital, also known as the Lion Capital, was discovered in which location?",Bharhut,Sanchi,Sarnath,Bodh Gaya,c
Which of the following stupa sites is NOT located in Uttar Pradesh?,Ramabhar,Sarnath,Bharhut,Kushinagar,c
'Milinda Panha' is a dialogue between King Milinda and which Buddhist monk?,Mahakasyapa,Nagasena,Vasubandhu,Asanga,b
In which year was the Hoysaleswara Temple constructed?,1050,1250,1150,1350,c
The 'Bhitargaon brick temple' is located in which state?,Madhya Pradesh,Bihar,Uttar Pradesh,Haryana,c
"The Barabar Caves, known for their Buddhist cave temples, are situated in which Indian state?",Uttar Pradesh,Bihar,Madhya Pradesh,Odisha,b
"In which state is the Ramabhar Stupa, the cremation site of Lord Buddha, located?",Bihar,Madhya Pradesh,Uttar Pradesh,Arunachal Pradesh,c
To which sect were the Nagarjuni caves donated by the Mauryas?,Jainism,Buddhism,Ajivika,Shaivism,c
The ancient temple dedicated to Bhima Devi is located in which state?,Punjab,Haryana,Himachal Pradesh,Uttarakhand,b
The Dilwara Temple is related to which religion?,Buddhism,Jainism,Hinduism,Sikhism,b
The Dilwara temples of Jainism are located in which location of India?,Sanchi,Sarnath,Mount Abu,Ellora,c
The Chennakesava temple was built during the rule of which empire?,Maurya,Gupta,Hoysala,Pallava,c
Where is the Shore Temple located?,Kanchipuram,Madurai,Mahabalipuram,Thanjavur,c
During whose reign was the Kailasanatham temple in Kanchipuram constructed?,Cholas,Pallavas,Pandyas,Hoysalas,b
In which city is the Meenakshi Temple located?,Kanchipuram,Madurai,Mahabalipuram,Thanjavur,b
Who built the Thousand Pillar Temple?,Narasimha Varman,Mahendravarman,Rudra Deva,Pulakeshin II,c
In which state is the Sanchi Stupa located?,Uttar Pradesh,Bihar,Madhya Pradesh,Haryana,c
"The Maurya pillar capital, also known as the Lion Capital, was found in:",Mathura,Sanchi,Sarnath,Bodh Gaya,c
Which stupa site is NOT located in Uttar Pradesh?,Ramabhar,Sarnath,Bharhut,Kushinagar,c
In which year was the Hoysaleswara Temple built?,1050,1150,1250,1350,b
Which Indian state is home to the Barabar Caves?,Uttar Pradesh,Bihar,Madhya Pradesh,Odisha,b
"The Ramabhar Stupa, the place of Lord Buddha's cremation, is in which state?",Bihar,Madhya Pradesh,Uttar Pradesh,Sikkim,c
The Nagarjuni caves were donated by the Mauryas to which sect?,Buddhists,Jains,Ajivikas,Hindus,c
The ancient temple dedicated to Bhima Devi is located in:,"Khajuraho, Madhya Pradesh","Pinjore, Haryana","Mount Abu, Rajasthan","Guwahati, Assam",b
