Question,Option A,Option B,Option C,Option D,Correct Answer
On the banks of which river did the Vedic civilization develop?,Indus,Ganga,Saraswati,Yamuna,c
What did the people of Turkey call the language used by the people east of the Indus in the sixth-fifth century BC?,Sanskrit,Prakrit,Hindvi,Pali,c
How many Mahajanapadas are mentioned in Jain and Buddhist texts of the sixth century BC?,Twelve,Eighteen,Fifteen,Sixteen,d
Who was the last ruler of the Magadha empire (Nanda dynasty)?,Bimbisara,Ajatashatru,Shishunaga,Dhanananda,d
"In ancient times, by what name was 'Awadh' known?",Magadha,Kosala,Avanti,Matsya,b
The sixteen Mahajanapadas are mentioned in which text?,Mahabharata,Ramayana,Anguttara Nikaya,Arthashastra,c
The Matsya Mahajanapada of the 6th century B.C. was located in which region?,Bihar,Uttar Pradesh,Rajasthan,Madhya Pradesh,c
During whose time was the power of Magadha expanded over the Malwa region?,Bimbisara,Ajatashatru,Shishunaga,Udayin,c
"In which region was a canal dug on the order of the Nanda king, according to inscribed evidence?",Magadha,Kalinga,Kosala,Avanti,b
"In the supreme period of Aryan culture, how many Janapadas of the Ganga valley became Mahajanapadas?",12,14,16,18,c
The sixteen Mahajanapadas are mentioned in which Buddhist text?,Tripitaka,Vinaya Pitaka,Anguttara Nikaya,Sutta Pitaka,c
"According to inscribed evidence, on whose order was a canal dug in Kalinga?",Ashoka,Kharavela,Mahapadmananda,Bimbisara,c
The earliest capital of the Magadha empire in ancient India was:,Vaishali,Pataliputra,Rajgir,Champa,c
Which rivers surrounded the Magadha Mahajanapada?,Ganga and Yamuna,Son and Gomti,Ganga and Son,Yamuna and Gomti,c
The capital of Vajji Mahajanapada was:,Rajagriha,Vaishali,Champa,Pataliputra,b
Which dynasty ruled Magadha after the Nanda dynasty?,Haryanka dynasty,Mauryan dynasty,Avanti dynasty,Vajji dynasty,b
Bimbisara was the king of which dynasty?,Nanda dynasty,Mauryan dynasty,Haryanka dynasty,Avanti dynasty,c
Who was the last ruler of the Nanda dynasty?,Ajatashatru,Udayin,Bimbisara,Dhanananda,d
"In the fourth century BC, the capital of Magadha was shifted to:",Rajgir,Vaishali,Pataliputra,Champa,c
The most important fundamental principle of Jainism is:,Satya,Brahacharya,Ahimsa,Asteya,c
Shvetambara and Digambara are sects of which religion?,Buddhism,Hinduism,Jainism,Sikhism,c
Who was the 23rd Tirthankara of Jainism?,Mahavira,Rishabhadeva,Parshvanatha,Nandivardhan,c
Who was the first Jain Tirthankara?,Mahavira,Rishabhadeva,Parshvanatha,Nandivardhan,b
To whom is the Soniji Ki Nasian temple of Ajmer dedicated?,Lord Mahavira,Lord Parshvanatha,Lord Rishabhadeva,Lord Gautama Buddha,c
The water temple related to Jainism was built by:,King Ajatashatru,King Bimbisara,King Nandivardhan,King Dhanananda,c
"Match the following:
Column I
(A) First Capital of Magadha
(B) Capital of Vajji
Column II
(1) Vaishali
(2) Rajagriha","A-1, B-2","A-2, B-1","A-2, B-2","A-1, B-1",b
Which of the following statements is INCORRECT regarding Bimbisara?,He was the king of the Haryanka dynasty.,He sent Jivaka for the treatment of the king of Avanti dynasty.,He was the first ruler of the Haryanka dynasty.,He shifted the capital to Pataliputra.,d
The Magadha Mahajanapada was surrounded by which rivers?,Ganga and Yamuna,Son and Gomti,Ganga and Son,Yamuna and Gomti,c
The last ruler of the Nanda dynasty was:,Ajatashatru,Udayin,Bimbisara,Dhanananda,d
The 24th or the last Jain Tirthankara was:,Rishabhadeva,Parshvanatha,Mahavira,Nandivardhan,c
The first Jain Tirthankara was:,Mahavira,Parshvanatha,Nandivardhan,Rishabhadeva,d
The Soniji Ki Nasian temple of Ajmer is dedicated to:,Lord Mahavira,Lord Parshvanatha,Lord Rishabhadeva,Lord Nandivardhan,c
"Match the following:
Column I          Column II
A. First Capital of Magadha      1. Vaishali
B. Capital of Vajji             2. Rajagriha","A-1, B-2","A-2, B-1","A-1, B-1","A-2, B-2",b
Which of the following rivers surrounded the Magadha Mahajanapada?,Yamuna and Ganga,Ganga and Son,Brahmaputra and Ganga,Son and Kosi,b
Which dynasty ruled Magadha immediately after the Nanda dynasty?,Haryanka dynasty,Mauryan dynasty,Gupta dynasty,Kushan dynasty,b
Bimbisara belonged to which dynasty?,Nanda dynasty,Mauryan dynasty,Haryanka dynasty,Gupta dynasty,c
In which century BC was the capital of Magadha shifted to Pataliputra?,Sixth century BC,Fifth century BC,Fourth century BC,Third century BC,c
The ancient city of Champa was the capital of which Mahajanapada?,Vajji,Anga,Magadha,Avanti,b
Who was the first ruler of the Haryanka dynasty from Magadha?,Udayin,Ajatashatru,Bimbisara,Nandivardhan,c
What is the most important fundamental principle of Jainism?,Satya,Asteya,Ahimsa,Aparigraha,c
The organization named Gaccha is related to:,Buddhism,Hinduism,Jainism,Ajivika,c
Who was the 24th or the last Jain Tirthankara?,Parshvanatha,Rishabhadeva,Mahavira,Neminatha,c
The first empire of ancient India to extensively use elephants in warfare was:,Mauryan,Vajji,Nanda,Magadha,d
How many great powers (Mahajanapadas) existed during the lifetime of Lord Gautama Buddha?,12,14,16,18,c
Which Mahajanapada had Champa as its capital?,Vajji,Magadha,Anga,Avanti,c
The Mauryan dynasty succeeded which dynasty in ruling Magadha?,Haryanka,Shunga,Kushana,Nanda,d
"Jivaka, the famous physician, served in the court of:",Ajatashatru,Dhanananda,Udayin,Bimbisara,d
Which ruler of the Haryanka dynasty was the son of Ajatashatru?,Bimbisara,Dhanananda,Udayin,Parshvanatha,c
For the treatment of which dynasty's king did Bimbisara send Jivaka?,Nanda dynasty,Avanti dynasty,Mauryan dynasty,Vajji dynasty,b
Which Magadha emperor annexed Anga into his empire?,Ajatashatru,Dhanananda,Udayin,Bimbisara,d
Who was the 24th Jain Tirthankara?,Rishabhadeva,Parshvanatha,Nandivardhan,Mahavira,d
What is a Tirthankara called in Jainism?,A destroyer of evil,The protector of religion and a spiritual teacher,The creator of the universe,A celestial being,b
What is it called when a Tirthankara leaves his mortal body?,Moksha,Samadhi,Nirvana,Rebirth,c
Which Agama describes non-violence in Jainism?,Tripitaka,Sutrakritanga Sutra,Anguttara Nikaya,Dhammapada,b
Who is considered the first Tirthankara of Jainism?,Mahavira,Parshvanatha,Rishabhanatha,Gautama Buddha,c
Vardhamana Mahavira was which Tirthankara of Jainism?,First,Twenty-third,Twenty-fifth,Twenty-fourth,d
"Among the five vows of Jainism, which one means non-attachment?",Ahimsa,Satya,Asteya,Aparigraha,d
Who gave Jainism its present form?,Rishabhanatha,Parshvanatha,Mahavira,Bhadrabahu,c
At which place was Swami Mahavira born?,Sravasti,Lumbini,Kundagrama,Pataliputra,c
The teachings of Mahavira are currently available at which location?,Ayodhya,Vallabhi in Gujarat,Mathura,Vaishali,b
"The word 'Jain' is derived from the Sanskrit word 'Jina', which means:",Teacher,Victor,Preacher,Liberator,b
"In which state is the Palitana temple, a Jain pilgrimage site, located?",Rajasthan,Maharashtra,Gujarat,Madhya Pradesh,c
The Digambara sect is related to which religion?,Buddhism,Jainism,Hinduism,Sikhism,b
Lord Mahavira was born in the early sixth century BC at:,Kushinagar,Vaishali,Rajgir,Pawapuri,b
What is the original name of Lord Mahavira?,Siddhartha,Gautama,Vardhamana,Rahul,c
Jain monastic institutions are called:,Viharas,Basadis,Monasteries,Ashrams,b
Mahavira is considered the last Tirthankara among the how many Tirthankaras?,22nd,23rd,25th,24th,d
"Parshvanatha, the son of King Ashvasena of Banaras, became which Tirthankara of Jainism?",First,Twenty-second,Twenty-third,Twenty-fourth,c
The word Shvetambara is associated with which religion?,Buddhism,Hinduism,Jainism,Sikhism,c
Who was the founder of Jainism?,Mahavira,Parshvanatha,Rishabhadeva,Gautama Buddha,c
The Jain Kalpasutra was composed by:,Mahavira,Parshvanatha,Bhadrabahu,Gautama Buddha,c
"The supreme goal of human life is 'Kaivalya', which means:",To attain enlightenment,To conquer desires,To achieve salvation,To gain wealth,b
A significant center of study during the Pala period in India was:,Nalanda,Taxila,Vikramshila,Valabhi,c
The most important teachers of Vikramshila University were:,"Virochana, Atisha, Dipankara and Ratnakar Shanti","Nagarjuna, Asanga, Vasubandhu and Dignaga","Aryabhata, Brahmagupta, Bhaskara and Varahamihira","Panini, Patanjali, Katyayana and Pingala",a
The excavation of Taxila University was carried out by:,Alexander Cunningham,John Marshall,James Prinsep,Aurel Stein,b
Who was Mahavira's first follower?,Anuyoginidvara,Jamali,Ajatashatru,Bimbisara,b
"The principle of Triratna (Right Faith, Right Knowledge, Right Conduct) is the glory of which religion?",Buddhism,Hinduism,Jainism,Sikhism,c
"The founder of the ""Ajivaka"" sect was:",Gautama Buddha,Mahavira,Makkhali Gosala,Ajita Kesakambali,c
Early Jain literature was written in which language?,Sanskrit,Pali,The Ardha-Magadhi language,Prakrit,c
Yapaniya was a sect of:,Buddhism,Hinduism,Jainism,Ajivika,c
The word Tirthankara is related to:,Buddhism,Hinduism,Jainism,Sikhism,c
What is it known as when a Tirthankara leaves his mortal body?,Moksha,Samadhi,Nirvana,Parinirvana,c
Vardhamana Mahavira was the what number Tirthankara of Jainism?,22nd,23rd,25th,24th,d
Which of the five vows of Jainism means non-attachment?,Satya,Asteya,Brahmacharya,Aparigraha,d
Where was Swami Mahavira born?,Sravasti,Kundagrama,Lumbini,Pava,b
Where are the teachings of Mahavira currently available?,Rajgir in Bihar,Sarnath in Uttar Pradesh,Vallabhi in Gujarat,Ujjain in Madhya Pradesh,c
"From which Sanskrit word is the word 'Jain' derived, and what does it mean?","'Karma', which means 'action'","'Dharma', which means 'righteousness'","'Jina', which means 'Victor'","'Ahinsa', which means 'non-violence'",c
"In which state is the Palitana temple, a pilgrimage site of Jainism, located?",Rajasthan,Maharashtra,Gujarat,Madhya Pradesh,c
In what century was Lord Mahavira born?,Early fifth century BC,Late seventh century BC,Early sixth century BC,Late fourth century BC,c
What are Jain monastic institutions called?,Viharas,Mathas,Basadis,Ashrams,c
Who was the twenty-third Tirthankara of Jainism?,Rishabhanatha,Mahavira,Parshvanatha,Neminatha,c
Who composed the Jain Kalpasutra?,Sthulabhadra,Bhadrabahu,Hemachandra,Haribhadra,b
"What does 'Kaivalya', the supreme goal of human life, mean?",To achieve enlightenment,To conquer desires,To attain liberation,To realize the self,b
Who carried out the excavation of Taxila University?,Alexander Cunningham,John Marshall,James Prinsep,Dayaram Sahni,b
"The principle of Triratna (Right Faith, Right Knowledge, Right Conduct) is associated with which religion?",Buddhism,Hinduism,Jainism,Sikhism,c
"Who was the founder of the ""Ajivika"" sect?",Gautama Buddha,Mahavira,Makkhali Gosala,Ajita Kesakambali,c
In which language was early Jain literature written?,Sanskrit,Pali,The Ardha-Magadhi language,Prakrit,c
Yapaniya was a sect of which religion?,Buddhism,Hinduism,Jainism,Ajivika,c
The word Tirthankara is related to which of the following?,Hinduism,Buddhism,Jainism,Sikhism,c
The 'Agama' that describes non-violence in Jainism is known as which of the following?,Tripitaka Sutra,Anguttara Nikaya,Sutrakritanga Sutra,Dhammapada,c
The Digambara sect is related to which of the following religions?,Buddhism,Hinduism,Jainism,Sikhism,c
The Jain Kalpasutra was composed by whom?,Parshvanatha,Mahavira,Bhadrabahu,Rishabhadeva,c
"Match the following:

Column I
(A) Rishabhanatha
(B) Mahavira
(C) Parshvanatha

Column II
(1) 23rd Tirthankara
(2) 24th Tirthankara
(3) First Tirthankara","A-3, B-1, C-2","A-2, B-3, C-1","A-3, B-2, C-1","A-1, B-2, C-3",c
Which of the following statements is INCORRECT regarding Jainism?,The word Shvetambara is associated with Jainism,Jain monastic institutions are called Basadis,The founder of Jainism was Rishabhadeva,The teachings of Mahavira are available in Taxila,d
Which of the following statements is NOT correct?,Lord Mahavira was born in the early sixth century BC at Vaishali,Yapaniya was a sect of Jainism,"The supreme goal of human life is 'Kaivalya', which means to gain wealth","When a Tirthankara leaves his mortal body, it is known as Nirvana",c
What is 'Nirvana' known as in Jainism?,A state of enlightenment,The final sermon of Mahavira,When a Tirthankara leaves his mortal body,The ultimate sacrifice,c
Vardhamana Mahavira was the ______ Tirthankara of Jainism.,Twenty-second,Twenty-third,Twenty-fifth,Twenty-fourth,d
"Parshvanatha, the son of King Ashvasena of Banaras, became the ______ Tirthankara of Jainism.",Twenty-second,Twenty-third,Twenty-fourth,Twenty-fifth,b
The word Shvetambara is associated with:,Buddhism,Jainism,Hinduism,Sikhism,b
"What does 'Kaivalya', the supreme goal of human life in Jainism, mean?",To attain peace,To conquer desires,To achieve enlightenment,To gain knowledge,b
Which of the following was a significant center of study during the Pala period in India?,Nalanda,Taxila,Vikramshila,Vallabhi,c
Who among the following were the most important teachers of Vikramshila University?,"Virochana, Atisha, Dipankara and Ratnakar Shanti","Panini, Aryabhata, Varahamihira and Brahmagupta","Kalidasa, Bhasa, Shudraka and Harsha","Kautilya, Megasthenes, Seleucus and Chandragupta",a
Early Jain literature was written in:,Sanskrit,Pali,The Ardha-Magadhi language,Prakrit,c
The Shvetambara Agama was finally compiled in which Jain council?,Vallabhi,Pawapuri,Pataliputra,Ayodhya,c
For which religious group is Prabhasgiri a pilgrimage site?,Buddhists,Charvakas,Jains,Hindus,c
Which religion does NOT subscribe to the concept of a 'world-destroying deluge'?,Hinduism,Buddhism,Jainism,Sikhism,c
The holy books of the Jains are collectively known as:,Tripitaka,Jataka Tales,Agama Siddhanta,Vedas,c
Which philosophical school rejected the belief in reincarnation?,Jainism,Buddhism,Charvaka,Hinduism,c
Who was the last Tirthankara in Jainism?,Rishabhadeva,Sambhavanatha,Vardhamana Mahavira,Suvidhinatha,c
At which location did Lord Mahavira attain Moksha?,Vallabhi,Shravasti,Pawapuri,Ayodhya,c
How many Tirthankaras are recognized in Jainism?,12,20,24,30,c
Vardhamana Mahavira was the son of the chief of which Kshatriya clan?,Maurya,Gupta,Shatrika (or Jnatrika),Nanda,c
'Paryushana Parva' is celebrated by which community?,The Buddhist community,The Jain community,The Hindu community,The Sikh community,b
In which present-day state was Lord Mahavira born?,Uttar Pradesh,Gujarat,Bihar,Madhya Pradesh,c
Santhara is a religious rite practiced by which community?,Buddhism,Jainism,Hinduism,Sikhism,b
Which city is recognized as the birthplace of the first and fourth Jain Tirthankaras?,Pabhosa,Shravasti,Ayodhya,Kakandi,c
"According to Jain philosophy, what does the word 'Jina' signify?",Teacher,King,Victor,Saint,c
Where are the teachings of Mahavira currently preserved?,"Pataliputra, Bihar","Vallabhi, Gujarat","Kapilavastu, Nepal","Shravasti, Uttar Pradesh",b
"Match the following Tirthankaras with their birthplaces:

   I. Sambhavanatha      A. Ayodhya
  II. Suvidhinatha      B. Pabhosa
 III. Rishabhanatha     C. Shravasti
  IV. Padmaprabhu       D. Kakandi

Choose the correct sequence:","I-A, II-B, III-C, IV-D","I-C, II-D, III-A, IV-B","I-B, II-A, III-D, IV-C","I-D, II-C, III-B, IV-A",b
Gautama Buddha attained knowledge on the banks of which river?,Ganga,Yamuna,Niranjana,Saraswati,c
'Tripitaka' is primarily related to which religion?,Jainism,Hinduism,Buddhism,Sikhism,c
Which historical figure was a follower of Buddhism?,Chandragupta Maurya,Ashoka,Kanishka,Harshavardhana,b
Which ruler is known for propagating Buddhism abroad?,Kanishka,Ashoka,Harshavardhana,Chandragupta Maurya,b
'Jataka tales' are associated with the life and teachings of:,Vardhamana Mahavira,Rishabhadeva,Gautama Buddha,Parshvanatha,c
In which city was the third Buddhist council held?,Kapilavastu,Ayodhya,Pataliputra,Vallabhi,c
The Shakya dynasty rulers governed which of the following places?,Pataliputra,Shravasti,Kapilavastu,Ayodhya,c
Which religion does NOT adhere to the concept of a 'world-destroying deluge'?,Hinduism,Buddhism,Jainism,Sikhism,c
Which philosophy rejected the belief in reincarnation?,Jainism,Buddhism,Charvaka,Hinduism,c
Who was the last Tirthankara of the Jains?,Rishabhadeva,Parshvanatha,Sambhavanatha,Vardhamana Mahavira,d
The 'Paryushana Parva' is celebrated by which community for self-purification?,Buddhist,Jain,Hindu,Sikh,b
'Santhara' is a religious rite belonging to which community?,Buddhist,Jain,Hindu,Sikh,b
The teachings of Mahavira are currently preserved at which location?,"Pataliputra, Bihar","Shravasti, Uttar Pradesh","Vallabhi, Gujarat","Pawapuri, Bihar",c
"Match the following Jain Tirthankaras with their birthplaces:
I. Sambhavanatha
II. Suvidhinatha
III. Rishabhanatha
IV. Padmaprabhu

A. Kakandi
B. Pabhosa
C. Ayodhya
D. Shravasti","I-A, II-B, III-C, IV-D","I-D, II-A, III-C, IV-B","I-C, II-D, III-B, IV-A","I-B, II-C, III-A, IV-D",b
'Tripitaka' is primarily associated with which religion?,Jainism,Hinduism,Buddhism,Sikhism,c
Which of the following historical figures was a follower of Buddhism?,Chandragupta Maurya,Ashoka,Kanishka,Harshavardhana,b
The 'Jataka tales' are primarily related to the life and teachings of:,Rishabhadeva,Parshvanatha,Vardhamana Mahavira,Gautama Buddha,d
Which place was ruled by the Shakya dynasty?,Pataliputra,Ayodhya,Kapilavastu,Shravasti,c
Which of the following religions does NOT believe in the concept of 'world-destroying deluge'?,Hinduism,Buddhism,Jainism,Sikhism,c
The holy books of the Jains are called:,Tripitaka,Jataka Tales,Agama Siddhanta,Vedas,c
At which place did Lord Mahavira attain Moksha?,Vallabhi,Ayodhya,Pataliputra,Pawapuri,d
The religion that had 24 Tirthankaras was:,Buddhism,Hinduism,Jainism,Sikhism,c
'Paryushana Parva' for self-purification is celebrated by which community?,Buddhist,Hindu,Jain,Sikh,c
Who was the first Tirthankara of Jainism?,Vardhamana Mahavira,Parshvanatha,Rishabhadeva,Neminatha,c
Santhara is a religious rite of which community?,Buddhist,Hindu,Jain,Sikh,c
Which holy city is recognized as the birthplace of the first and fourth Jain Tirthankaras?,Vallabhi,Pabhosa,Shravasti,Ayodhya,d
"According to Jain philosophy, what does the word 'Jina' mean?",Teacher,Liberator,Victor,Wanderer,c
The teachings of Mahavira are currently present at:,"Shravasti, Uttar Pradesh","Ayodhya, Uttar Pradesh","Vallabhi, Gujarat","Pataliputra, Bihar",c
"Match the following Jain Tirthankaras with their birthplaces:

Column I (Tirthankara)         Column II (Birthplace)
A. Sambhavanatha             1. Kakandi
B. Suvidhinatha               2. Ayodhya
C. Rishabhanatha              3. Shravasti
D. Padmaprabhu                4. Pabhosa

","A-3, B-1, C-2, D-4","A-1, B-2, C-3, D-4","A-2, B-3, C-4, D-1","A-4, B-3, C-2, D-1",a
'Tripitaka' is related to which religion?,Jainism,Hinduism,Buddhism,Sikhism,c
Who among the following was a follower of Buddhism?,Chandragupta Maurya,Ashoka,Kanishka,Harshavardhana,b
Who propagated Buddhism abroad?,Chandragupta Maurya,Ashoka,Kanishka,Harshavardhana,b
'Jataka tales' are related to:,Rishabhadeva,Vardhamana Mahavira,Gautama Buddha,Parshvanatha,c
The third Buddhist council was held in:,Vallabhi,Ayodhya,Pataliputra,Pawapuri,c
The place ruled by the Shakya dynasty rulers was:,Pataliputra,Kapilavastu,Shravasti,Kushinagar,b
What are the holy books of the Jains called?,Tripitaka,Vedas,Agama Siddhanta,Sutras,c
Lord Mahavira was born in which present-day state?,Uttar Pradesh,Madhya Pradesh,Bihar,Gujarat,c
"Match the following Tirthankaras with their respective birthplaces:

Column I
(A) Sambhavanatha
(B) Suvidhinatha
(C) Rishabhanatha
(D) Padmaprabhu

Column II
(1) Kakandi
(2) Shravasti
(3) Pabhosa
(4) Ayodhya

Choose the correct sequence:","A-2, B-1, C-4, D-3","A-1, B-2, C-3, D-4","A-4, B-3, C-2, D-1","A-3, B-4, C-1, D-2",a
Which ruler propagated Buddhism abroad?,Kanishka,Ashoka,Harshavardhana,Chandragupta Maurya,b
'Jataka tales' are related to which figure?,Mahavira,Parshvanatha,Rishabhadeva,Gautama Buddha,d
The third Buddhist council was held in which city?,Vaishali,Rajagriha,Pataliputra,Kushinagar,c
At which location did Gautama Buddha deliver his inaugural sermon?,Kushinagar,Bodh Gaya,Sarnath,Rajgir,c
The first Buddhist council convened at which of the following locations?,Vaishali,Kushinagar,Sarnath,Rajgir,d
In which city is a 200-foot-tall bronze statue of Lord Buddha planned to be installed?,Sarnath,Bodh Gaya,Rajgir,Kushinagar,d
Where did Buddha attain Mahaparinirvana?,Bodh Gaya,Sarnath,Vaishali,Kushinagar,d
Which monument is associated with Gautama Buddha's propagation of his divine knowledge?,Simhachaturmukha pillar,Sarnath pillar,Mahabodhi Temple Complex,Vaishali Stupa,c
"According to Buddhist belief, where did Gautama Buddha attain Parinirvana after his death?",Bodh Gaya,Sarnath,Rajgir,Kushinagar,d
Which of the following is NOT a Tipitaka?,Sutta Pitaka,Vinaya Pitaka,Abhidhamma Pitaka,Upasaka Pitaka,d
What title was Gautama known by after attaining knowledge?,Siddhartha,Shakya,Nagarjuna,Buddha,d
What is the significance of Bodh Gaya as a Buddhist pilgrimage center?,Buddha delivered his last sermon here.,Buddha was born here.,Gautama Buddha attained knowledge here.,The first Buddhist Council was held here.,c
"In which present-day state is Sarnath, the location of Buddha's first sermon, situated?",Bihar,Madhya Pradesh,Uttar Pradesh,West Bengal,c
Which of the following figures is identified as a Buddhist philosopher?,Kalasoka,Siddhartha,Nagarjuna,Shakya,c
Buddha's first sermon to his five disciples at Sarnath is referred to as:,Mahaparinirvana,Tripitaka,Dharmachakrapravartana,Parinirvana,c
The second Buddhist council in Vaishali was conducted during the reign of:,Ashoka,Kanishka,Kalasoka,Harshavardhana,c
Therigatha is part of which collection of verses composed by nuns?,Vinaya Pitaka,Abhidhamma Pitaka,Sutta Pitaka,Upasaka Pitaka,c
Which of the three Pitakas is specifically related to philosophical matters?,Vinaya Pitaka,Sutta Pitaka,Abhidhamma Pitaka,Upasaka Pitaka,c
Where did Gautama (Siddhartha) meditate for six years before going to Bodh Gaya?,Sarnath,Rajgir,Kushinagar,Pragbodhi,d
Gautama Buddha belonged to which Gana?,Maurya,Gupta,Shakya,Kushan,c
In which city did Gautama Buddha attain knowledge?,Sarnath,Rajgir,Kushinagar,Bodh Gaya,d
Which of the following is a sacred text associated with Buddhism?,Ramayana,Mahabharata,Tripitaka,Bhagavad Gita,c
Hinayana and Mahayana are sects of which religion?,Jainism,Hinduism,Buddhism,Sikhism,c
The Simhachaturmukha pillar is located at:,Vaishali,Kushinagar,Bodh Gaya,Sarnath,d
The concept of Bodhisattva is related to which branch of Buddhism?,Theravada Buddhism,Hinayana Buddhism,Mahayana Buddhism,Vajrayana Buddhism,c
The first Buddhist council was convened at which of the following locations?,Kushinagar,Bodh Gaya,Sarnath,Rajgir,d
Where is the planned installation site for a 200-foot-tall bronze statue of Lord Buddha?,Sarnath,Vaishali,Kushinagar,Bodh Gaya,c
In which city did Buddha attain Mahaparinirvana?,Bodh Gaya,Rajgir,Sarnath,Kushinagar,d
From which monument did Gautama Buddha propagate his divine knowledge of Buddhism?,Simhachaturmukha pillar,Mahabodhi Temple Complex,Dhamma-Chakra-Pravartana Mudra,Sarnath pillar,b
"According to Buddhist belief, Gautama Buddha attained Parinirvana in which location after his death?",Bodh Gaya,Vaishali,Kushinagar,Sarnath,c
"After attaining knowledge, Gautama was known as:",Shakya,Nagarjuna,Buddha,Kalasoka,c
The first sermon of Lord Buddha after attaining knowledge was given in:,Kushinagar,Bodh Gaya,Sarnath,Rajgir,c
What is the significance of Sarnath for Buddhists?,Buddha attained Mahaparinirvana here,Buddha attained knowledge here,Buddha gave his first sermon here,The second Buddhist council was held here,c
Who among the following was a Buddhist philosopher?,Kalasoka,Shakya,Nagarjuna,Buddha,c
Buddha's first sermon to his five disciples at Sarnath is called:,Mahaparinirvana,Tripitaka,Parinirvana,Dharmachakrapravartana,d
The second Buddhist council in Vaishali was conducted by:,Nagarjuna,Buddha,Kalasoka,Shakya,c
Therigatha is a part of which Pitaka?,Vinaya Pitaka,Abhidhamma Pitaka,Sutta Pitaka,Upasaka Pitaka,c
Which Pitaka relates to philosophical matters?,Sutta Pitaka,Vinaya Pitaka,Abhidhamma Pitaka,Upasaka Pitaka,c
"Before going to Bodh Gaya for final enlightenment, Gautama meditated for six years at:",Sarnath,Rajgir,Pragbodhi,Vaishali,c
Which of the following is a sacred text related to Buddhism?,Upasaka Pitaka,Therigatha,Tripitaka,Pragbodhi,c
The concept of Bodhisattva is related to:,Hinayana Buddhism,Therigatha,Mahayana Buddhism,Tripitaka,c
A 200-foot-tall bronze statue of Lord Buddha is to be installed in which city?,Sarnath,Rajgir,Bodh Gaya,Kushinagar,d
What title did Gautama acquire after attaining knowledge?,Nagarjuna,Therigatha,Buddha,Kalasoka,c
Why is Bodh Gaya a significant Buddhist pilgrimage center?,Buddha delivered his first sermon here.,Buddha attained Mahaparinirvana here.,Buddha attained knowledge here.,The second Buddhist council was held here.,c
Sarnath's importance for Buddhists primarily stems from which event?,Buddha's birth.,Buddha's Mahaparinirvana.,Buddha's attainment of knowledge.,Buddha's first sermon.,d
Which individual is identified as a Buddhist philosopher in the provided text?,Kalasoka,Nagarjuna,Upasaka,Therigatha,b
What is the term for Buddha's first sermon to his five disciples at Sarnath?,Mahaparinirvana,Tripitaka,Dharmachakrapravartana,Parinirvana,c
Who conducted the second Buddhist council in Vaishali?,Nagarjuna,Buddha,Kalasoka,Upasaka,c
Therigatha is part of which Pitaka?,Vinaya Pitaka,Abhidhamma Pitaka,Sutta Pitaka,Upasaka Pitaka,c
Which Pitaka is specifically related to philosophical matters?,Sutta Pitaka,Vinaya Pitaka,Upasaka Pitaka,Abhidhamma Pitaka,d
To which Gana did Gautama Buddha belong?,Malla,Maurya,Shakya,Lichchavi,c
Where is the Simhachaturmukha pillar located?,Kushinagar,Bodh Gaya,Sarnath,Rajgir,c
The first Buddhist council took place at which of the following locations?,Vaishali,Kushinagar,Rajgir,Sarnath,c
